logia, l, o, g, i, a, lo, og, gi, ia, log, ogi, gia, logi, ogia
logic, l, o, g, i, c, lo, og, gi, ic, log, ogi, gic, logi, ogic
login, l, o, g, i, n, lo, og, gi, in, log, ogi, gin, logi, ogin
logoi, l, o, g, o, i, lo, og, go, oi, log, ogo, goi, logo, ogoi
logon, l, o, g, o, n, lo, og, go, on, log, ogo, gon, logo, ogon
logos, l, o, g, o, s, lo, og, go, os, log, ogo, gos, logo, ogos
loids, l, o, i, d, s, lo, oi, id, ds, loi, oid, ids, loid, oids
loins, l, o, i, n, s, lo, oi, in, ns, loi, oin, ins, loin, oins
lolls, l, o, l, l, s, lo, ol, ll, ls, lol, oll, lls, loll, olls
lolly, l, o, l, l, y, lo, ol, ll, ly, lol, oll, lly, loll, olly
loner, l, o, n, e, r, lo, on, ne, er, lon, one, ner, lone, oner
longe, l, o, n, g, e, lo, on, ng, ge, lon, ong, nge, long, onge
longs, l, o, n, g, s, lo, on, ng, gs, lon, ong, ngs, long, ongs
looby, l, o, o, b, y, lo, oo, ob, by, loo, oob, oby, loob, ooby
looed, l, o, o, e, d, lo, oo, oe, ed, loo, ooe, oed, looe, ooed
looey, l, o, o, e, y, lo, oo, oe, ey, loo, ooe, oey, looe, ooey
loofa, l, o, o, f, a, lo, oo, of, fa, loo, oof, ofa, loof, oofa
loofs, l, o, o, f, s, lo, oo, of, fs, loo, oof, ofs, loof, oofs
looie, l, o, o, i, e, lo, oo, oi, ie, loo, ooi, oie, looi, ooie
looks, l, o, o, k, s, lo, oo, ok, ks, loo, ook, oks, look, ooks
looms, l, o, o, m, s, lo, oo, om, ms, loo, oom, oms, loom, ooms
loons, l, o, o, n, s, lo, oo, on, ns, loo, oon, ons, loon, oons
loony, l, o, o, n, y, lo, oo, on, ny, loo, oon, ony, loon, oony
loops, l, o, o, p, s, lo, oo, op, ps, loo, oop, ops, loop, oops
loopy, l, o, o, p, y, lo, oo, op, py, loo, oop, opy, loop, oopy
loose, l, o, o, s, e, lo, oo, os, se, loo, oos, ose, loos, oose
loots, l, o, o, t, s, lo, oo, ot, ts, loo, oot, ots, loot, oots
loped, l, o, p, e, d, lo, op, pe, ed, lop, ope, ped, lope, oped
loper, l, o, p, e, r, lo, op, pe, er, lop, ope, per, lope, oper
lopes, l, o, p, e, s, lo, op, pe, es, lop, ope, pes, lope, opes
loppy, l, o, p, p, y, lo, op, pp, py, lop, opp, ppy, lopp, oppy
loral, l, o, r, a, l, lo, or, ra, al, lor, ora, ral, lora, oral
loran, l, o, r, a, n, lo, or, ra, an, lor, ora, ran, lora, oran
lords, l, o, r, d, s, lo, or, rd, ds, lor, ord, rds, lord, ords
lores, l, o, r, e, s, lo, or, re, es, lor, ore, res, lore, ores
loris, l, o, r, i, s, lo, or, ri, is, lor, ori, ris, lori, oris
lorry, l, o, r, r, y, lo, or, rr, ry, lor, orr, rry, lorr, orry
losel, l, o, s, e, l, lo, os, se, el, los, ose, sel, lose, osel
loser, l, o, s, e, r, lo, os, se, er, los, ose, ser, lose, oser
loses, l, o, s, e, s, lo, os, se, es, los, ose, ses, lose, oses
lossy, l, o, s, s, y, lo, os, ss, sy, los, oss, ssy, loss, ossy
lotah, l, o, t, a, h, lo, ot, ta, ah, lot, ota, tah, lota, otah
lotas, l, o, t, a, s, lo, ot, ta, as, lot, ota, tas, lota, otas
lotic, l, o, t, i, c, lo, ot, ti, ic, lot, oti, tic, loti, otic
lotos, l, o, t, o, s, lo, ot, to, os, lot, oto, tos, loto, otos
lotte, l, o, t, t, e, lo, ot, tt, te, lot, ott, tte, lott, otte
lotto, l, o, t, t, o, lo, ot, tt, to, lot, ott, tto, lott, otto
lotus, l, o, t, u, s, lo, ot, tu, us, lot, otu, tus, lotu, otus
lough, l, o, u, g, h, lo, ou, ug, gh, lou, oug, ugh, loug, ough
louie, l, o, u, i, e, lo, ou, ui, ie, lou, oui, uie, loui, ouie
louis, l, o, u, i, s, lo, ou, ui, is, lou, oui, uis, loui, ouis
louma, l, o, u, m, a, lo, ou, um, ma, lou, oum, uma, loum, ouma
loupe, l, o, u, p, e, lo, ou, up, pe, lou, oup, upe, loup, oupe
loups, l, o, u, p, s, lo, ou, up, ps, lou, oup, ups, loup, oups
lours, l, o, u, r, s, lo, ou, ur, rs, lou, our, urs, lour, ours
loury, l, o, u, r, y, lo, ou, ur, ry, lou, our, ury, lour, oury
louse, l, o, u, s, e, lo, ou, us, se, lou, ous, use, lous, ouse
lousy, l, o, u, s, y, lo, ou, us, sy, lou, ous, usy, lous, ousy
louts, l, o, u, t, s, lo, ou, ut, ts, lou, out, uts, lout, outs
lovat, l, o, v, a, t, lo, ov, va, at, lov, ova, vat, lova, ovat
loved, l, o, v, e, d, lo, ov, ve, ed, lov, ove, ved, love, oved
lover, l, o, v, e, r, lo, ov, ve, er, lov, ove, ver, love, over
loves, l, o, v, e, s, lo, ov, ve, es, lov, ove, ves, love, oves
lowed, l, o, w, e, d, lo, ow, we, ed, low, owe, wed, lowe, owed
lower, l, o, w, e, r, lo, ow, we, er, low, owe, wer, lowe, ower
lowes, l, o, w, e, s, lo, ow, we, es, low, owe, wes, lowe, owes
lowly, l, o, w, l, y, lo, ow, wl, ly, low, owl, wly, lowl, owly
lowse, l, o, w, s, e, lo, ow, ws, se, low, ows, wse, lows, owse
loxed, l, o, x, e, d, lo, ox, xe, ed, lox, oxe, xed, loxe, oxed
loxes, l, o, x, e, s, lo, ox, xe, es, lox, oxe, xes, loxe, oxes
loyal, l, o, y, a, l, lo, oy, ya, al, loy, oya, yal, loya, oyal
luaus, l, u, a, u, s, lu, ua, au, us, lua, uau, aus, luau, uaus
lubed, l, u, b, e, d, lu, ub, be, ed, lub, ube, bed, lube, ubed
lubes, l, u, b, e, s, lu, ub, be, es, lub, ube, bes, lube, ubes
luces, l, u, c, e, s, lu, uc, ce, es, luc, uce, ces, luce, uces
lucid, l, u, c, i, d, lu, uc, ci, id, luc, uci, cid, luci, ucid
lucks, l, u, c, k, s, lu, uc, ck, ks, luc, uck, cks, luck, ucks
lucky, l, u, c, k, y, lu, uc, ck, ky, luc, uck, cky, luck, ucky
lucre, l, u, c, r, e, lu, uc, cr, re, luc, ucr, cre, lucr, ucre
ludes, l, u, d, e, s, lu, ud, de, es, lud, ude, des, lude, udes
ludic, l, u, d, i, c, lu, ud, di, ic, lud, udi, dic, ludi, udic
luffa, l, u, f, f, a, lu, uf, ff, fa, luf, uff, ffa, luff, uffa
luffs, l, u, f, f, s, lu, uf, ff, fs, luf, uff, ffs, luff, uffs
luged, l, u, g, e, d, lu, ug, ge, ed, lug, uge, ged, luge, uged
luger, l, u, g, e, r, lu, ug, ge, er, lug, uge, ger, luge, uger
luges, l, u, g, e, s, lu, ug, ge, es, lug, uge, ges, luge, uges
lulls, l, u, l, l, s, lu, ul, ll, ls, lul, ull, lls, lull, ulls
lulus, l, u, l, u, s, lu, ul, lu, us, lul, ulu, lus, lulu, ulus
lumas, l, u, m, a, s, lu, um, ma, as, lum, uma, mas, luma, umas
lumen, l, u, m, e, n, lu, um, me, en, lum, ume, men, lume, umen
lumps, l, u, m, p, s, lu, um, mp, ps, lum, ump, mps, lump, umps
lumpy, l, u, m, p, y, lu, um, mp, py, lum, ump, mpy, lump, umpy
lunar, l, u, n, a, r, lu, un, na, ar, lun, una, nar, luna, unar
lunas, l, u, n, a, s, lu, un, na, as, lun, una, nas, luna, unas
lunch, l, u, n, c, h, lu, un, nc, ch, lun, unc, nch, lunc, unch
lunes, l, u, n, e, s, lu, un, ne, es, lun, une, nes, lune, unes
lunet, l, u, n, e, t, lu, un, ne, et, lun, une, net, lune, unet
lunge, l, u, n, g, e, lu, un, ng, ge, lun, ung, nge, lung, unge
lungi, l, u, n, g, i, lu, un, ng, gi, lun, ung, ngi, lung, ungi
lungs, l, u, n, g, s, lu, un, ng, gs, lun, ung, ngs, lung, ungs
lunks, l, u, n, k, s, lu, un, nk, ks, lun, unk, nks, lunk, unks
lunts, l, u, n, t, s, lu, un, nt, ts, lun, unt, nts, lunt, unts
lupin, l, u, p, i, n, lu, up, pi, in, lup, upi, pin, lupi, upin
lupus, l, u, p, u, s, lu, up, pu, us, lup, upu, pus, lupu, upus
lurch, l, u, r, c, h, lu, ur, rc, ch, lur, urc, rch, lurc, urch
lured, l, u, r, e, d, lu, ur, re, ed, lur, ure, red, lure, ured
lurer, l, u, r, e, r, lu, ur, re, er, lur, ure, rer, lure, urer
lures, l, u, r, e, s, lu, ur, re, es, lur, ure, res, lure, ures
lurex, l, u, r, e, x, lu, ur, re, ex, lur, ure, rex, lure, urex
lurid, l, u, r, i, d, lu, ur, ri, id, lur, uri, rid, luri, urid
lurks, l, u, r, k, s, lu, ur, rk, ks, lur, urk, rks, lurk, urks
lusts, l, u, s, t, s, lu, us, st, ts, lus, ust, sts, lust, usts
lusty, l, u, s, t, y, lu, us, st, ty, lus, ust, sty, lust, usty
lusus, l, u, s, u, s, lu, us, su, us, lus, usu, sus, lusu, usus
lutea, l, u, t, e, a, lu, ut, te, ea, lut, ute, tea, lute, utea
luted, l, u, t, e, d, lu, ut, te, ed, lut, ute, ted, lute, uted
lutes, l, u, t, e, s, lu, ut, te, es, lut, ute, tes, lute, utes
luxes, l, u, x, e, s, lu, ux, xe, es, lux, uxe, xes, luxe, uxes
lweis, l, w, e, i, s, lw, we, ei, is, lwe, wei, eis, lwei, weis
lyard, l, y, a, r, d, ly, ya, ar, rd, lya, yar, ard, lyar, yard
lyart, l, y, a, r, t, ly, ya, ar, rt, lya, yar, art, lyar, yart
lyase, l, y, a, s, e, ly, ya, as, se, lya, yas, ase, lyas, yase
lycea, l, y, c, e, a, ly, yc, ce, ea, lyc, yce, cea, lyce, ycea
lycee, l, y, c, e, e, ly, yc, ce, ee, lyc, yce, cee, lyce, ycee
lycra, l, y, c, r, a, ly, yc, cr, ra, lyc, ycr, cra, lycr, ycra
lying, l, y, i, n, g, ly, yi, in, ng, lyi, yin, ing, lyin, ying
lymph, l, y, m, p, h, ly, ym, mp, ph, lym, ymp, mph, lymp, ymph
lynch, l, y, n, c, h, ly, yn, nc, ch, lyn, ync, nch, lync, ynch
lyres, l, y, r, e, s, ly, yr, re, es, lyr, yre, res, lyre, yres
lyric, l, y, r, i, c, ly, yr, ri, ic, lyr, yri, ric, lyri, yric
lysed, l, y, s, e, d, ly, ys, se, ed, lys, yse, sed, lyse, ysed
lyses, l, y, s, e, s, ly, ys, se, es, lys, yse, ses, lyse, yses
lysin, l, y, s, i, n, ly, ys, si, in, lys, ysi, sin, lysi, ysin
lysis, l, y, s, i, s, ly, ys, si, is, lys, ysi, sis, lysi, ysis
lyssa, l, y, s, s, a, ly, ys, ss, sa, lys, yss, ssa, lyss, yssa
lytic, l, y, t, i, c, ly, yt, ti, ic, lyt, yti, tic, lyti, ytic
lytta, l, y, t, t, a, ly, yt, tt, ta, lyt, ytt, tta, lytt, ytta
maars, m, a, a, r, s, ma, aa, ar, rs, maa, aar, ars, maar, aars
mabes, m, a, b, e, s, ma, ab, be, es, mab, abe, bes, mabe, abes
macaw, m, a, c, a, w, ma, ac, ca, aw, mac, aca, caw, maca, acaw
maced, m, a, c, e, d, ma, ac, ce, ed, mac, ace, ced, mace, aced
macer, m, a, c, e, r, ma, ac, ce, er, mac, ace, cer, mace, acer
maces, m, a, c, e, s, ma, ac, ce, es, mac, ace, ces, mace, aces
mache, m, a, c, h, e, ma, ac, ch, he, mac, ach, che, mach, ache
macho, m, a, c, h, o, ma, ac, ch, ho, mac, ach, cho, mach, acho
machs, m, a, c, h, s, ma, ac, ch, hs, mac, ach, chs, mach, achs
macks, m, a, c, k, s, ma, ac, ck, ks, mac, ack, cks, mack, acks
macle, m, a, c, l, e, ma, ac, cl, le, mac, acl, cle, macl, acle
macon, m, a, c, o, n, ma, ac, co, on, mac, aco, con, maco, acon
macro, m, a, c, r, o, ma, ac, cr, ro, mac, acr, cro, macr, acro
madam, m, a, d, a, m, ma, ad, da, am, mad, ada, dam, mada, adam
madly, m, a, d, l, y, ma, ad, dl, ly, mad, adl, dly, madl, adly
madre, m, a, d, r, e, ma, ad, dr, re, mad, adr, dre, madr, adre
mafia, m, a, f, i, a, ma, af, fi, ia, maf, afi, fia, mafi, afia
mafic, m, a, f, i, c, ma, af, fi, ic, maf, afi, fic, mafi, afic
mages, m, a, g, e, s, ma, ag, ge, es, mag, age, ges, mage, ages
magic, m, a, g, i, c, ma, ag, gi, ic, mag, agi, gic, magi, agic
magma, m, a, g, m, a, ma, ag, gm, ma, mag, agm, gma, magm, agma
magot, m, a, g, o, t, ma, ag, go, ot, mag, ago, got, mago, agot
magus, m, a, g, u, s, ma, ag, gu, us, mag, agu, gus, magu, agus
mahoe, m, a, h, o, e, ma, ah, ho, oe, mah, aho, hoe, maho, ahoe
maids, m, a, i, d, s, ma, ai, id, ds, mai, aid, ids, maid, aids
maile, m, a, i, l, e, ma, ai, il, le, mai, ail, ile, mail, aile
maill, m, a, i, l, l, ma, ai, il, ll, mai, ail, ill, mail, aill
mails, m, a, i, l, s, ma, ai, il, ls, mai, ail, ils, mail, ails
maims, m, a, i, m, s, ma, ai, im, ms, mai, aim, ims, maim, aims
mains, m, a, i, n, s, ma, ai, in, ns, mai, ain, ins, main, ains
mairs, m, a, i, r, s, ma, ai, ir, rs, mai, air, irs, mair, airs
maist, m, a, i, s, t, ma, ai, is, st, mai, ais, ist, mais, aist
maize, m, a, i, z, e, ma, ai, iz, ze, mai, aiz, ize, maiz, aize
major, m, a, j, o, r, ma, aj, jo, or, maj, ajo, jor, majo, ajor
makar, m, a, k, a, r, ma, ak, ka, ar, mak, aka, kar, maka, akar
maker, m, a, k, e, r, ma, ak, ke, er, mak, ake, ker, make, aker
makes, m, a, k, e, s, ma, ak, ke, es, mak, ake, kes, make, akes
makos, m, a, k, o, s, ma, ak, ko, os, mak, ako, kos, mako, akos
malar, m, a, l, a, r, ma, al, la, ar, mal, ala, lar, mala, alar
males, m, a, l, e, s, ma, al, le, es, mal, ale, les, male, ales
malic, m, a, l, i, c, ma, al, li, ic, mal, ali, lic, mali, alic
malls, m, a, l, l, s, ma, al, ll, ls, mal, all, lls, mall, alls
malms, m, a, l, m, s, ma, al, lm, ms, mal, alm, lms, malm, alms
malmy, m, a, l, m, y, ma, al, lm, my, mal, alm, lmy, malm, almy
malts, m, a, l, t, s, ma, al, lt, ts, mal, alt, lts, malt, alts
malty, m, a, l, t, y, ma, al, lt, ty, mal, alt, lty, malt, alty
mamas, m, a, m, a, s, ma, am, ma, as, mam, ama, mas, mama, amas
mamba, m, a, m, b, a, ma, am, mb, ba, mam, amb, mba, mamb, amba
mambo, m, a, m, b, o, ma, am, mb, bo, mam, amb, mbo, mamb, ambo
mamey, m, a, m, e, y, ma, am, me, ey, mam, ame, mey, mame, amey
mamie, m, a, m, i, e, ma, am, mi, ie, mam, ami, mie, mami, amie
mamma, m, a, m, m, a, ma, am, mm, ma, mam, amm, mma, mamm, amma
mammy, m, a, m, m, y, ma, am, mm, my, mam, amm, mmy, mamm, ammy
manas, m, a, n, a, s, ma, an, na, as, man, ana, nas, mana, anas
manat, m, a, n, a, t, ma, an, na, at, man, ana, nat, mana, anat
maned, m, a, n, e, d, ma, an, ne, ed, man, ane, ned, mane, aned
manes, m, a, n, e, s, ma, an, ne, es, man, ane, nes, mane, anes
manga, m, a, n, g, a, ma, an, ng, ga, man, ang, nga, mang, anga
mange, m, a, n, g, e, ma, an, ng, ge, man, ang, nge, mang, ange
mango, m, a, n, g, o, ma, an, ng, go, man, ang, ngo, mang, ango
mangy, m, a, n, g, y, ma, an, ng, gy, man, ang, ngy, mang, angy
mania, m, a, n, i, a, ma, an, ni, ia, man, ani, nia, mani, ania
manic, m, a, n, i, c, ma, an, ni, ic, man, ani, nic, mani, anic
manly, m, a, n, l, y, ma, an, nl, ly, man, anl, nly, manl, anly
manna, m, a, n, n, a, ma, an, nn, na, man, ann, nna, mann, anna
manor, m, a, n, o, r, ma, an, no, or, man, ano, nor, mano, anor
manos, m, a, n, o, s, ma, an, no, os, man, ano, nos, mano, anos
manse, m, a, n, s, e, ma, an, ns, se, man, ans, nse, mans, anse
manta, m, a, n, t, a, ma, an, nt, ta, man, ant, nta, mant, anta
manus, m, a, n, u, s, ma, an, nu, us, man, anu, nus, manu, anus
maple, m, a, p, l, e, ma, ap, pl, le, map, apl, ple, mapl, aple
maqui, m, a, q, u, i, ma, aq, qu, ui, maq, aqu, qui, maqu, aqui
maras, m, a, r, a, s, ma, ar, ra, as, mar, ara, ras, mara, aras
march, m, a, r, c, h, ma, ar, rc, ch, mar, arc, rch, marc, arch
marcs, m, a, r, c, s, ma, ar, rc, cs, mar, arc, rcs, marc, arcs
mares, m, a, r, e, s, ma, ar, re, es, mar, are, res, mare, ares
marge, m, a, r, g, e, ma, ar, rg, ge, mar, arg, rge, marg, arge
maria, m, a, r, i, a, ma, ar, ri, ia, mar, ari, ria, mari, aria
marka, m, a, r, k, a, ma, ar, rk, ka, mar, ark, rka, mark, arka
marks, m, a, r, k, s, ma, ar, rk, ks, mar, ark, rks, mark, arks
marls, m, a, r, l, s, ma, ar, rl, ls, mar, arl, rls, marl, arls
marly, m, a, r, l, y, ma, ar, rl, ly, mar, arl, rly, marl, arly
marry, m, a, r, r, y, ma, ar, rr, ry, mar, arr, rry, marr, arry
marse, m, a, r, s, e, ma, ar, rs, se, mar, ars, rse, mars, arse
marsh, m, a, r, s, h, ma, ar, rs, sh, mar, ars, rsh, mars, arsh
marts, m, a, r, t, s, ma, ar, rt, ts, mar, art, rts, mart, arts
marvy, m, a, r, v, y, ma, ar, rv, vy, mar, arv, rvy, marv, arvy
masas, m, a, s, a, s, ma, as, sa, as, mas, asa, sas, masa, asas
maser, m, a, s, e, r, ma, as, se, er, mas, ase, ser, mase, aser
mashy, m, a, s, h, y, ma, as, sh, hy, mas, ash, shy, mash, ashy
masks, m, a, s, k, s, ma, as, sk, ks, mas, ask, sks, mask, asks
mason, m, a, s, o, n, ma, as, so, on, mas, aso, son, maso, ason
massa, m, a, s, s, a, ma, as, ss, sa, mas, ass, ssa, mass, assa
masse, m, a, s, s, e, ma, as, ss, se, mas, ass, sse, mass, asse
massy, m, a, s, s, y, ma, as, ss, sy, mas, ass, ssy, mass, assy
masts, m, a, s, t, s, ma, as, st, ts, mas, ast, sts, mast, asts
match, m, a, t, c, h, ma, at, tc, ch, mat, atc, tch, matc, atch
mated, m, a, t, e, d, ma, at, te, ed, mat, ate, ted, mate, ated
mater, m, a, t, e, r, ma, at, te, er, mat, ate, ter, mate, ater
mates, m, a, t, e, s, ma, at, te, es, mat, ate, tes, mate, ates
matey, m, a, t, e, y, ma, at, te, ey, mat, ate, tey, mate, atey
maths, m, a, t, h, s, ma, at, th, hs, mat, ath, ths, math, aths
matin, m, a, t, i, n, ma, at, ti, in, mat, ati, tin, mati, atin
matte, m, a, t, t, e, ma, at, tt, te, mat, att, tte, matt, atte
matts, m, a, t, t, s, ma, at, tt, ts, mat, att, tts, matt, atts
matza, m, a, t, z, a, ma, at, tz, za, mat, atz, tza, matz, atza
matzo, m, a, t, z, o, ma, at, tz, zo, mat, atz, tzo, matz, atzo
mauds, m, a, u, d, s, ma, au, ud, ds, mau, aud, uds, maud, auds
mauls, m, a, u, l, s, ma, au, ul, ls, mau, aul, uls, maul, auls
maund, m, a, u, n, d, ma, au, un, nd, mau, aun, und, maun, aund
mauts, m, a, u, t, s, ma, au, ut, ts, mau, aut, uts, maut, auts
mauve, m, a, u, v, e, ma, au, uv, ve, mau, auv, uve, mauv, auve
maven, m, a, v, e, n, ma, av, ve, en, mav, ave, ven, mave, aven
mavie, m, a, v, i, e, ma, av, vi, ie, mav, avi, vie, mavi, avie
mavin, m, a, v, i, n, ma, av, vi, in, mav, avi, vin, mavi, avin
mavis, m, a, v, i, s, ma, av, vi, is, mav, avi, vis, mavi, avis
mawed, m, a, w, e, d, ma, aw, we, ed, maw, awe, wed, mawe, awed
maxed, m, a, x, e, d, ma, ax, xe, ed, max, axe, xed, maxe, axed
maxes, m, a, x, e, s, ma, ax, xe, es, max, axe, xes, maxe, axes
maxim, m, a, x, i, m, ma, ax, xi, im, max, axi, xim, maxi, axim
maxis, m, a, x, i, s, ma, ax, xi, is, max, axi, xis, maxi, axis
mayan, m, a, y, a, n, ma, ay, ya, an, may, aya, yan, maya, ayan
mayas, m, a, y, a, s, ma, ay, ya, as, may, aya, yas, maya, ayas
maybe, m, a, y, b, e, ma, ay, yb, be, may, ayb, ybe, mayb, aybe
mayed, m, a, y, e, d, ma, ay, ye, ed, may, aye, yed, maye, ayed
mayor, m, a, y, o, r, ma, ay, yo, or, may, ayo, yor, mayo, ayor
mayos, m, a, y, o, s, ma, ay, yo, os, may, ayo, yos, mayo, ayos
mayst, m, a, y, s, t, ma, ay, ys, st, may, ays, yst, mays, ayst
mazed, m, a, z, e, d, ma, az, ze, ed, maz, aze, zed, maze, azed
mazer, m, a, z, e, r, ma, az, ze, er, maz, aze, zer, maze, azer
mazes, m, a, z, e, s, ma, az, ze, es, maz, aze, zes, maze, azes
mbira, m, b, i, r, a, mb, bi, ir, ra, mbi, bir, ira, mbir, bira
meads, m, e, a, d, s, me, ea, ad, ds, mea, ead, ads, mead, eads
meals, m, e, a, l, s, me, ea, al, ls, mea, eal, als, meal, eals
mealy, m, e, a, l, y, me, ea, al, ly, mea, eal, aly, meal, ealy
means, m, e, a, n, s, me, ea, an, ns, mea, ean, ans, mean, eans
meant, m, e, a, n, t, me, ea, an, nt, mea, ean, ant, mean, eant
meany, m, e, a, n, y, me, ea, an, ny, mea, ean, any, mean, eany
meats, m, e, a, t, s, me, ea, at, ts, mea, eat, ats, meat, eats
meaty, m, e, a, t, y, me, ea, at, ty, mea, eat, aty, meat, eaty
mecca, m, e, c, c, a, me, ec, cc, ca, mec, ecc, cca, mecc, ecca
medal, m, e, d, a, l, me, ed, da, al, med, eda, dal, meda, edal
media, m, e, d, i, a, me, ed, di, ia, med, edi, dia, medi, edia
medic, m, e, d, i, c, me, ed, di, ic, med, edi, dic, medi, edic
medii, m, e, d, i, i, me, ed, di, ii, med, edi, dii, medi, edii
meeds, m, e, e, d, s, me, ee, ed, ds, mee, eed, eds, meed, eeds
meets, m, e, e, t, s, me, ee, et, ts, mee, eet, ets, meet, eets
meiny, m, e, i, n, y, me, ei, in, ny, mei, ein, iny, mein, einy
melds, m, e, l, d, s, me, el, ld, ds, mel, eld, lds, meld, elds
melee, m, e, l, e, e, me, el, le, ee, mel, ele, lee, mele, elee
melic, m, e, l, i, c, me, el, li, ic, mel, eli, lic, meli, elic
mells, m, e, l, l, s, me, el, ll, ls, mel, ell, lls, mell, ells
melon, m, e, l, o, n, me, el, lo, on, mel, elo, lon, melo, elon
melts, m, e, l, t, s, me, el, lt, ts, mel, elt, lts, melt, elts
melty, m, e, l, t, y, me, el, lt, ty, mel, elt, lty, melt, elty
memes, m, e, m, e, s, me, em, me, es, mem, eme, mes, meme, emes
memos, m, e, m, o, s, me, em, mo, os, mem, emo, mos, memo, emos
menad, m, e, n, a, d, me, en, na, ad, men, ena, nad, mena, enad
mends, m, e, n, d, s, me, en, nd, ds, men, end, nds, mend, ends
mensa, m, e, n, s, a, me, en, ns, sa, men, ens, nsa, mens, ensa
mense, m, e, n, s, e, me, en, ns, se, men, ens, nse, mens, ense
mensh, m, e, n, s, h, me, en, ns, sh, men, ens, nsh, mens, ensh
menta, m, e, n, t, a, me, en, nt, ta, men, ent, nta, ment, enta
menus, m, e, n, u, s, me, en, nu, us, men, enu, nus, menu, enus
meous, m, e, o, u, s, me, eo, ou, us, meo, eou, ous, meou, eous
meows, m, e, o, w, s, me, eo, ow, ws, meo, eow, ows, meow, eows
merch, m, e, r, c, h, me, er, rc, ch, mer, erc, rch, merc, erch
mercs, m, e, r, c, s, me, er, rc, cs, mer, erc, rcs, merc, ercs
mercy, m, e, r, c, y, me, er, rc, cy, mer, erc, rcy, merc, ercy
merde, m, e, r, d, e, me, er, rd, de, mer, erd, rde, merd, erde
merer, m, e, r, e, r, me, er, re, er, mer, ere, rer, mere, erer
meres, m, e, r, e, s, me, er, re, es, mer, ere, res, mere, eres
merge, m, e, r, g, e, me, er, rg, ge, mer, erg, rge, merg, erge
merit, m, e, r, i, t, me, er, ri, it, mer, eri, rit, meri, erit
merks, m, e, r, k, s, me, er, rk, ks, mer, erk, rks, merk, erks
merle, m, e, r, l, e, me, er, rl, le, mer, erl, rle, merl, erle
merls, m, e, r, l, s, me, er, rl, ls, mer, erl, rls, merl, erls
merry, m, e, r, r, y, me, er, rr, ry, mer, err, rry, merr, erry
mesas, m, e, s, a, s, me, es, sa, as, mes, esa, sas, mesa, esas
meshy, m, e, s, h, y, me, es, sh, hy, mes, esh, shy, mesh, eshy
mesic, m, e, s, i, c, me, es, si, ic, mes, esi, sic, mesi, esic
mesne, m, e, s, n, e, me, es, sn, ne, mes, esn, sne, mesn, esne
meson, m, e, s, o, n, me, es, so, on, mes, eso, son, meso, eson
messy, m, e, s, s, y, me, es, ss, sy, mes, ess, ssy, mess, essy
metal, m, e, t, a, l, me, et, ta, al, met, eta, tal, meta, etal
meted, m, e, t, e, d, me, et, te, ed, met, ete, ted, mete, eted
meter, m, e, t, e, r, me, et, te, er, met, ete, ter, mete, eter
metes, m, e, t, e, s, me, et, te, es, met, ete, tes, mete, etes
meths, m, e, t, h, s, me, et, th, hs, met, eth, ths, meth, eths
metis, m, e, t, i, s, me, et, ti, is, met, eti, tis, meti, etis
metol, m, e, t, o, l, me, et, to, ol, met, eto, tol, meto, etol
metre, m, e, t, r, e, me, et, tr, re, met, etr, tre, metr, etre
metro, m, e, t, r, o, me, et, tr, ro, met, etr, tro, metr, etro
mewed, m, e, w, e, d, me, ew, we, ed, mew, ewe, wed, mewe, ewed
mewls, m, e, w, l, s, me, ew, wl, ls, mew, ewl, wls, mewl, ewls
mezes, m, e, z, e, s, me, ez, ze, es, mez, eze, zes, meze, ezes
mezzo, m, e, z, z, o, me, ez, zz, zo, mez, ezz, zzo, mezz, ezzo
miaou, m, i, a, o, u, mi, ia, ao, ou, mia, iao, aou, miao, iaou
miaow, m, i, a, o, w, mi, ia, ao, ow, mia, iao, aow, miao, iaow
miasm, m, i, a, s, m, mi, ia, as, sm, mia, ias, asm, mias, iasm
miaul, m, i, a, u, l, mi, ia, au, ul, mia, iau, aul, miau, iaul
micas, m, i, c, a, s, mi, ic, ca, as, mic, ica, cas, mica, icas
miche, m, i, c, h, e, mi, ic, ch, he, mic, ich, che, mich, iche
micks, m, i, c, k, s, mi, ic, ck, ks, mic, ick, cks, mick, icks
micra, m, i, c, r, a, mi, ic, cr, ra, mic, icr, cra, micr, icra
micro, m, i, c, r, o, mi, ic, cr, ro, mic, icr, cro, micr, icro
middy, m, i, d, d, y, mi, id, dd, dy, mid, idd, ddy, midd, iddy
midge, m, i, d, g, e, mi, id, dg, ge, mid, idg, dge, midg, idge
midis, m, i, d, i, s, mi, id, di, is, mid, idi, dis, midi, idis
midst, m, i, d, s, t, mi, id, ds, st, mid, ids, dst, mids, idst
miens, m, i, e, n, s, mi, ie, en, ns, mie, ien, ens, mien, iens
miffs, m, i, f, f, s, mi, if, ff, fs, mif, iff, ffs, miff, iffs
miffy, m, i, f, f, y, mi, if, ff, fy, mif, iff, ffy, miff, iffy
miggs, m, i, g, g, s, mi, ig, gg, gs, mig, igg, ggs, migg, iggs
might, m, i, g, h, t, mi, ig, gh, ht, mig, igh, ght, migh, ight
miked, m, i, k, e, d, mi, ik, ke, ed, mik, ike, ked, mike, iked
mikes, m, i, k, e, s, mi, ik, ke, es, mik, ike, kes, mike, ikes
mikra, m, i, k, r, a, mi, ik, kr, ra, mik, ikr, kra, mikr, ikra
milch, m, i, l, c, h, mi, il, lc, ch, mil, ilc, lch, milc, ilch
milds, m, i, l, d, s, mi, il, ld, ds, mil, ild, lds, mild, ilds
miler, m, i, l, e, r, mi, il, le, er, mil, ile, ler, mile, iler
miles, m, i, l, e, s, mi, il, le, es, mil, ile, les, mile, iles
milia, m, i, l, i, a, mi, il, li, ia, mil, ili, lia, mili, ilia
milks, m, i, l, k, s, mi, il, lk, ks, mil, ilk, lks, milk, ilks
milky, m, i, l, k, y, mi, il, lk, ky, mil, ilk, lky, milk, ilky
mille, m, i, l, l, e, mi, il, ll, le, mil, ill, lle, mill, ille
mills, m, i, l, l, s, mi, il, ll, ls, mil, ill, lls, mill, ills
milos, m, i, l, o, s, mi, il, lo, os, mil, ilo, los, milo, ilos
milpa, m, i, l, p, a, mi, il, lp, pa, mil, ilp, lpa, milp, ilpa
milts, m, i, l, t, s, mi, il, lt, ts, mil, ilt, lts, milt, ilts
milty, m, i, l, t, y, mi, il, lt, ty, mil, ilt, lty, milt, ilty
mimed, m, i, m, e, d, mi, im, me, ed, mim, ime, med, mime, imed
mimeo, m, i, m, e, o, mi, im, me, eo, mim, ime, meo, mime, imeo
mimer, m, i, m, e, r, mi, im, me, er, mim, ime, mer, mime, imer
mimes, m, i, m, e, s, mi, im, me, es, mim, ime, mes, mime, imes
mimic, m, i, m, i, c, mi, im, mi, ic, mim, imi, mic, mimi, imic
minae, m, i, n, a, e, mi, in, na, ae, min, ina, nae, mina, inae
minas, m, i, n, a, s, mi, in, na, as, min, ina, nas, mina, inas
mince, m, i, n, c, e, mi, in, nc, ce, min, inc, nce, minc, ince
mincy, m, i, n, c, y, mi, in, nc, cy, min, inc, ncy, minc, incy
minds, m, i, n, d, s, mi, in, nd, ds, min, ind, nds, mind, inds
mined, m, i, n, e, d, mi, in, ne, ed, min, ine, ned, mine, ined
miner, m, i, n, e, r, mi, in, ne, er, min, ine, ner, mine, iner
mines, m, i, n, e, s, mi, in, ne, es, min, ine, nes, mine, ines
mingy, m, i, n, g, y, mi, in, ng, gy, min, ing, ngy, ming, ingy
minim, m, i, n, i, m, mi, in, ni, im, min, ini, nim, mini, inim
minis, m, i, n, i, s, mi, in, ni, is, min, ini, nis, mini, inis
minke, m, i, n, k, e, mi, in, nk, ke, min, ink, nke, mink, inke
minks, m, i, n, k, s, mi, in, nk, ks, min, ink, nks, mink, inks
minny, m, i, n, n, y, mi, in, nn, ny, min, inn, nny, minn, inny
minor, m, i, n, o, r, mi, in, no, or, min, ino, nor, mino, inor
mints, m, i, n, t, s, mi, in, nt, ts, min, int, nts, mint, ints
minty, m, i, n, t, y, mi, in, nt, ty, min, int, nty, mint, inty
minus, m, i, n, u, s, mi, in, nu, us, min, inu, nus, minu, inus
mired, m, i, r, e, d, mi, ir, re, ed, mir, ire, red, mire, ired
mires, m, i, r, e, s, mi, ir, re, es, mir, ire, res, mire, ires
mirex, m, i, r, e, x, mi, ir, re, ex, mir, ire, rex, mire, irex
mirin, m, i, r, i, n, mi, ir, ri, in, mir, iri, rin, miri, irin
mirks, m, i, r, k, s, mi, ir, rk, ks, mir, irk, rks, mirk, irks
mirky, m, i, r, k, y, mi, ir, rk, ky, mir, irk, rky, mirk, irky
mirth, m, i, r, t, h, mi, ir, rt, th, mir, irt, rth, mirt, irth
mirza, m, i, r, z, a, mi, ir, rz, za, mir, irz, rza, mirz, irza
misdo, m, i, s, d, o, mi, is, sd, do, mis, isd, sdo, misd, isdo
miser, m, i, s, e, r, mi, is, se, er, mis, ise, ser, mise, iser
mises, m, i, s, e, s, mi, is, se, es, mis, ise, ses, mise, ises
misos, m, i, s, o, s, mi, is, so, os, mis, iso, sos, miso, isos
missy, m, i, s, s, y, mi, is, ss, sy, mis, iss, ssy, miss, issy
mists, m, i, s, t, s, mi, is, st, ts, mis, ist, sts, mist, ists
misty, m, i, s, t, y, mi, is, st, ty, mis, ist, sty, mist, isty
