rugby, r, u, g, b, y, ru, ug, gb, by, rug, ugb, gby, rugb, ugby
ruing, r, u, i, n, g, ru, ui, in, ng, rui, uin, ing, ruin, uing
ruins, r, u, i, n, s, ru, ui, in, ns, rui, uin, ins, ruin, uins
ruled, r, u, l, e, d, ru, ul, le, ed, rul, ule, led, rule, uled
ruler, r, u, l, e, r, ru, ul, le, er, rul, ule, ler, rule, uler
rules, r, u, l, e, s, ru, ul, le, es, rul, ule, les, rule, ules
rumba, r, u, m, b, a, ru, um, mb, ba, rum, umb, mba, rumb, umba
rumen, r, u, m, e, n, ru, um, me, en, rum, ume, men, rume, umen
rummy, r, u, m, m, y, ru, um, mm, my, rum, umm, mmy, rumm, ummy
rumor, r, u, m, o, r, ru, um, mo, or, rum, umo, mor, rumo, umor
rumps, r, u, m, p, s, ru, um, mp, ps, rum, ump, mps, rump, umps
runes, r, u, n, e, s, ru, un, ne, es, run, une, nes, rune, unes
rungs, r, u, n, g, s, ru, un, ng, gs, run, ung, ngs, rung, ungs
runic, r, u, n, i, c, ru, un, ni, ic, run, uni, nic, runi, unic
runny, r, u, n, n, y, ru, un, nn, ny, run, unn, nny, runn, unny
runts, r, u, n, t, s, ru, un, nt, ts, run, unt, nts, runt, unts
runty, r, u, n, t, y, ru, un, nt, ty, run, unt, nty, runt, unty
rupee, r, u, p, e, e, ru, up, pe, ee, rup, upe, pee, rupe, upee
rural, r, u, r, a, l, ru, ur, ra, al, rur, ura, ral, rura, ural
ruses, r, u, s, e, s, ru, us, se, es, rus, use, ses, ruse, uses
rushy, r, u, s, h, y, ru, us, sh, hy, rus, ush, shy, rush, ushy
rusks, r, u, s, k, s, ru, us, sk, ks, rus, usk, sks, rusk, usks
rusts, r, u, s, t, s, ru, us, st, ts, rus, ust, sts, rust, usts
rusty, r, u, s, t, y, ru, us, st, ty, rus, ust, sty, rust, usty
ruths, r, u, t, h, s, ru, ut, th, hs, rut, uth, ths, ruth, uths
rutin, r, u, t, i, n, ru, ut, ti, in, rut, uti, tin, ruti, utin
rutty, r, u, t, t, y, ru, ut, tt, ty, rut, utt, tty, rutt, utty
ryked, r, y, k, e, d, ry, yk, ke, ed, ryk, yke, ked, ryke, yked
rykes, r, y, k, e, s, ry, yk, ke, es, ryk, yke, kes, ryke, ykes
rynds, r, y, n, d, s, ry, yn, nd, ds, ryn, ynd, nds, rynd, ynds
ryots, r, y, o, t, s, ry, yo, ot, ts, ryo, yot, ots, ryot, yots
sabal, s, a, b, a, l, sa, ab, ba, al, sab, aba, bal, saba, abal
sabed, s, a, b, e, d, sa, ab, be, ed, sab, abe, bed, sabe, abed
saber, s, a, b, e, r, sa, ab, be, er, sab, abe, ber, sabe, aber
sabes, s, a, b, e, s, sa, ab, be, es, sab, abe, bes, sabe, abes
sabin, s, a, b, i, n, sa, ab, bi, in, sab, abi, bin, sabi, abin
sabir, s, a, b, i, r, sa, ab, bi, ir, sab, abi, bir, sabi, abir
sable, s, a, b, l, e, sa, ab, bl, le, sab, abl, ble, sabl, able
sabot, s, a, b, o, t, sa, ab, bo, ot, sab, abo, bot, sabo, abot
sabra, s, a, b, r, a, sa, ab, br, ra, sab, abr, bra, sabr, abra
sabre, s, a, b, r, e, sa, ab, br, re, sab, abr, bre, sabr, abre
sacks, s, a, c, k, s, sa, ac, ck, ks, sac, ack, cks, sack, acks
sacra, s, a, c, r, a, sa, ac, cr, ra, sac, acr, cra, sacr, acra
sades, s, a, d, e, s, sa, ad, de, es, sad, ade, des, sade, ades
sadhe, s, a, d, h, e, sa, ad, dh, he, sad, adh, dhe, sadh, adhe
sadhu, s, a, d, h, u, sa, ad, dh, hu, sad, adh, dhu, sadh, adhu
sadis, s, a, d, i, s, sa, ad, di, is, sad, adi, dis, sadi, adis
sadly, s, a, d, l, y, sa, ad, dl, ly, sad, adl, dly, sadl, adly
safer, s, a, f, e, r, sa, af, fe, er, saf, afe, fer, safe, afer
safes, s, a, f, e, s, sa, af, fe, es, saf, afe, fes, safe, afes
sagas, s, a, g, a, s, sa, ag, ga, as, sag, aga, gas, saga, agas
sager, s, a, g, e, r, sa, ag, ge, er, sag, age, ger, sage, ager
sages, s, a, g, e, s, sa, ag, ge, es, sag, age, ges, sage, ages
saggy, s, a, g, g, y, sa, ag, gg, gy, sag, agg, ggy, sagg, aggy
sagos, s, a, g, o, s, sa, ag, go, os, sag, ago, gos, sago, agos
sagum, s, a, g, u, m, sa, ag, gu, um, sag, agu, gum, sagu, agum
sahib, s, a, h, i, b, sa, ah, hi, ib, sah, ahi, hib, sahi, ahib
saice, s, a, i, c, e, sa, ai, ic, ce, sai, aic, ice, saic, aice
saids, s, a, i, d, s, sa, ai, id, ds, sai, aid, ids, said, aids
saiga, s, a, i, g, a, sa, ai, ig, ga, sai, aig, iga, saig, aiga
sails, s, a, i, l, s, sa, ai, il, ls, sai, ail, ils, sail, ails
sains, s, a, i, n, s, sa, ai, in, ns, sai, ain, ins, sain, ains
saint, s, a, i, n, t, sa, ai, in, nt, sai, ain, int, sain, aint
saith, s, a, i, t, h, sa, ai, it, th, sai, ait, ith, sait, aith
sajou, s, a, j, o, u, sa, aj, jo, ou, saj, ajo, jou, sajo, ajou
saker, s, a, k, e, r, sa, ak, ke, er, sak, ake, ker, sake, aker
sakes, s, a, k, e, s, sa, ak, ke, es, sak, ake, kes, sake, akes
sakis, s, a, k, i, s, sa, ak, ki, is, sak, aki, kis, saki, akis
salad, s, a, l, a, d, sa, al, la, ad, sal, ala, lad, sala, alad
salal, s, a, l, a, l, sa, al, la, al, sal, ala, lal, sala, alal
salep, s, a, l, e, p, sa, al, le, ep, sal, ale, lep, sale, alep
sales, s, a, l, e, s, sa, al, le, es, sal, ale, les, sale, ales
salic, s, a, l, i, c, sa, al, li, ic, sal, ali, lic, sali, alic
sally, s, a, l, l, y, sa, al, ll, ly, sal, all, lly, sall, ally
salmi, s, a, l, m, i, sa, al, lm, mi, sal, alm, lmi, salm, almi
salol, s, a, l, o, l, sa, al, lo, ol, sal, alo, lol, salo, alol
salon, s, a, l, o, n, sa, al, lo, on, sal, alo, lon, salo, alon
salpa, s, a, l, p, a, sa, al, lp, pa, sal, alp, lpa, salp, alpa
salps, s, a, l, p, s, sa, al, lp, ps, sal, alp, lps, salp, alps
salsa, s, a, l, s, a, sa, al, ls, sa, sal, als, lsa, sals, alsa
salts, s, a, l, t, s, sa, al, lt, ts, sal, alt, lts, salt, alts
salty, s, a, l, t, y, sa, al, lt, ty, sal, alt, lty, salt, alty
salve, s, a, l, v, e, sa, al, lv, ve, sal, alv, lve, salv, alve
salvo, s, a, l, v, o, sa, al, lv, vo, sal, alv, lvo, salv, alvo
samba, s, a, m, b, a, sa, am, mb, ba, sam, amb, mba, samb, amba
sambo, s, a, m, b, o, sa, am, mb, bo, sam, amb, mbo, samb, ambo
samek, s, a, m, e, k, sa, am, me, ek, sam, ame, mek, same, amek
samps, s, a, m, p, s, sa, am, mp, ps, sam, amp, mps, samp, amps
sands, s, a, n, d, s, sa, an, nd, ds, san, and, nds, sand, ands
sandy, s, a, n, d, y, sa, an, nd, dy, san, and, ndy, sand, andy
saned, s, a, n, e, d, sa, an, ne, ed, san, ane, ned, sane, aned
saner, s, a, n, e, r, sa, an, ne, er, san, ane, ner, sane, aner
sanes, s, a, n, e, s, sa, an, ne, es, san, ane, nes, sane, anes
sanga, s, a, n, g, a, sa, an, ng, ga, san, ang, nga, sang, anga
sangh, s, a, n, g, h, sa, an, ng, gh, san, ang, ngh, sang, angh
santo, s, a, n, t, o, sa, an, nt, to, san, ant, nto, sant, anto
sapid, s, a, p, i, d, sa, ap, pi, id, sap, api, pid, sapi, apid
sapor, s, a, p, o, r, sa, ap, po, or, sap, apo, por, sapo, apor
sappy, s, a, p, p, y, sa, ap, pp, py, sap, app, ppy, sapp, appy
saran, s, a, r, a, n, sa, ar, ra, an, sar, ara, ran, sara, aran
sards, s, a, r, d, s, sa, ar, rd, ds, sar, ard, rds, sard, ards
saree, s, a, r, e, e, sa, ar, re, ee, sar, are, ree, sare, aree
sarge, s, a, r, g, e, sa, ar, rg, ge, sar, arg, rge, sarg, arge
sargo, s, a, r, g, o, sa, ar, rg, go, sar, arg, rgo, sarg, argo
sarin, s, a, r, i, n, sa, ar, ri, in, sar, ari, rin, sari, arin
saris, s, a, r, i, s, sa, ar, ri, is, sar, ari, ris, sari, aris
sarks, s, a, r, k, s, sa, ar, rk, ks, sar, ark, rks, sark, arks
sarky, s, a, r, k, y, sa, ar, rk, ky, sar, ark, rky, sark, arky
sarod, s, a, r, o, d, sa, ar, ro, od, sar, aro, rod, saro, arod
saros, s, a, r, o, s, sa, ar, ro, os, sar, aro, ros, saro, aros
sasin, s, a, s, i, n, sa, as, si, in, sas, asi, sin, sasi, asin
sassy, s, a, s, s, y, sa, as, ss, sy, sas, ass, ssy, sass, assy
satay, s, a, t, a, y, sa, at, ta, ay, sat, ata, tay, sata, atay
sated, s, a, t, e, d, sa, at, te, ed, sat, ate, ted, sate, ated
satem, s, a, t, e, m, sa, at, te, em, sat, ate, tem, sate, atem
sates, s, a, t, e, s, sa, at, te, es, sat, ate, tes, sate, ates
satin, s, a, t, i, n, sa, at, ti, in, sat, ati, tin, sati, atin
satis, s, a, t, i, s, sa, at, ti, is, sat, ati, tis, sati, atis
satyr, s, a, t, y, r, sa, at, ty, yr, sat, aty, tyr, saty, atyr
sauce, s, a, u, c, e, sa, au, uc, ce, sau, auc, uce, sauc, auce
sauch, s, a, u, c, h, sa, au, uc, ch, sau, auc, uch, sauc, auch
saucy, s, a, u, c, y, sa, au, uc, cy, sau, auc, ucy, sauc, aucy
saugh, s, a, u, g, h, sa, au, ug, gh, sau, aug, ugh, saug, augh
sauls, s, a, u, l, s, sa, au, ul, ls, sau, aul, uls, saul, auls
sault, s, a, u, l, t, sa, au, ul, lt, sau, aul, ult, saul, ault
sauna, s, a, u, n, a, sa, au, un, na, sau, aun, una, saun, auna
saury, s, a, u, r, y, sa, au, ur, ry, sau, aur, ury, saur, aury
saute, s, a, u, t, e, sa, au, ut, te, sau, aut, ute, saut, aute
saved, s, a, v, e, d, sa, av, ve, ed, sav, ave, ved, save, aved
saver, s, a, v, e, r, sa, av, ve, er, sav, ave, ver, save, aver
saves, s, a, v, e, s, sa, av, ve, es, sav, ave, ves, save, aves
savin, s, a, v, i, n, sa, av, vi, in, sav, avi, vin, savi, avin
savor, s, a, v, o, r, sa, av, vo, or, sav, avo, vor, savo, avor
savoy, s, a, v, o, y, sa, av, vo, oy, sav, avo, voy, savo, avoy
savvy, s, a, v, v, y, sa, av, vv, vy, sav, avv, vvy, savv, avvy
sawed, s, a, w, e, d, sa, aw, we, ed, saw, awe, wed, sawe, awed
sawer, s, a, w, e, r, sa, aw, we, er, saw, awe, wer, sawe, awer
saxes, s, a, x, e, s, sa, ax, xe, es, sax, axe, xes, saxe, axes
sayed, s, a, y, e, d, sa, ay, ye, ed, say, aye, yed, saye, ayed
sayer, s, a, y, e, r, sa, ay, ye, er, say, aye, yer, saye, ayer
sayid, s, a, y, i, d, sa, ay, yi, id, say, ayi, yid, sayi, ayid
sayst, s, a, y, s, t, sa, ay, ys, st, say, ays, yst, says, ayst
scabs, s, c, a, b, s, sc, ca, ab, bs, sca, cab, abs, scab, cabs
scads, s, c, a, d, s, sc, ca, ad, ds, sca, cad, ads, scad, cads
scags, s, c, a, g, s, sc, ca, ag, gs, sca, cag, ags, scag, cags
scald, s, c, a, l, d, sc, ca, al, ld, sca, cal, ald, scal, cald
scale, s, c, a, l, e, sc, ca, al, le, sca, cal, ale, scal, cale
scall, s, c, a, l, l, sc, ca, al, ll, sca, cal, all, scal, call
scalp, s, c, a, l, p, sc, ca, al, lp, sca, cal, alp, scal, calp
scaly, s, c, a, l, y, sc, ca, al, ly, sca, cal, aly, scal, caly
scamp, s, c, a, m, p, sc, ca, am, mp, sca, cam, amp, scam, camp
scams, s, c, a, m, s, sc, ca, am, ms, sca, cam, ams, scam, cams
scans, s, c, a, n, s, sc, ca, an, ns, sca, can, ans, scan, cans
scant, s, c, a, n, t, sc, ca, an, nt, sca, can, ant, scan, cant
scape, s, c, a, p, e, sc, ca, ap, pe, sca, cap, ape, scap, cape
scare, s, c, a, r, e, sc, ca, ar, re, sca, car, are, scar, care
scarf, s, c, a, r, f, sc, ca, ar, rf, sca, car, arf, scar, carf
scarp, s, c, a, r, p, sc, ca, ar, rp, sca, car, arp, scar, carp
scars, s, c, a, r, s, sc, ca, ar, rs, sca, car, ars, scar, cars
scart, s, c, a, r, t, sc, ca, ar, rt, sca, car, art, scar, cart
scary, s, c, a, r, y, sc, ca, ar, ry, sca, car, ary, scar, cary
scats, s, c, a, t, s, sc, ca, at, ts, sca, cat, ats, scat, cats
scatt, s, c, a, t, t, sc, ca, at, tt, sca, cat, att, scat, catt
scaup, s, c, a, u, p, sc, ca, au, up, sca, cau, aup, scau, caup
scaur, s, c, a, u, r, sc, ca, au, ur, sca, cau, aur, scau, caur
scena, s, c, e, n, a, sc, ce, en, na, sce, cen, ena, scen, cena
scend, s, c, e, n, d, sc, ce, en, nd, sce, cen, end, scen, cend
scene, s, c, e, n, e, sc, ce, en, ne, sce, cen, ene, scen, cene
scent, s, c, e, n, t, sc, ce, en, nt, sce, cen, ent, scen, cent
schav, s, c, h, a, v, sc, ch, ha, av, sch, cha, hav, scha, chav
schmo, s, c, h, m, o, sc, ch, hm, mo, sch, chm, hmo, schm, chmo
schul, s, c, h, u, l, sc, ch, hu, ul, sch, chu, hul, schu, chul
schwa, s, c, h, w, a, sc, ch, hw, wa, sch, chw, hwa, schw, chwa
scion, s, c, i, o, n, sc, ci, io, on, sci, cio, ion, scio, cion
scoff, s, c, o, f, f, sc, co, of, ff, sco, cof, off, scof, coff
scold, s, c, o, l, d, sc, co, ol, ld, sco, col, old, scol, cold
scone, s, c, o, n, e, sc, co, on, ne, sco, con, one, scon, cone
scoop, s, c, o, o, p, sc, co, oo, op, sco, coo, oop, scoo, coop
scoot, s, c, o, o, t, sc, co, oo, ot, sco, coo, oot, scoo, coot
scope, s, c, o, p, e, sc, co, op, pe, sco, cop, ope, scop, cope
scops, s, c, o, p, s, sc, co, op, ps, sco, cop, ops, scop, cops
score, s, c, o, r, e, sc, co, or, re, sco, cor, ore, scor, core
scorn, s, c, o, r, n, sc, co, or, rn, sco, cor, orn, scor, corn
scots, s, c, o, t, s, sc, co, ot, ts, sco, cot, ots, scot, cots
scour, s, c, o, u, r, sc, co, ou, ur, sco, cou, our, scou, cour
scout, s, c, o, u, t, sc, co, ou, ut, sco, cou, out, scou, cout
scowl, s, c, o, w, l, sc, co, ow, wl, sco, cow, owl, scow, cowl
scows, s, c, o, w, s, sc, co, ow, ws, sco, cow, ows, scow, cows
scrag, s, c, r, a, g, sc, cr, ra, ag, scr, cra, rag, scra, crag
scram, s, c, r, a, m, sc, cr, ra, am, scr, cra, ram, scra, cram
scrap, s, c, r, a, p, sc, cr, ra, ap, scr, cra, rap, scra, crap
scree, s, c, r, e, e, sc, cr, re, ee, scr, cre, ree, scre, cree
screw, s, c, r, e, w, sc, cr, re, ew, scr, cre, rew, scre, crew
scrim, s, c, r, i, m, sc, cr, ri, im, scr, cri, rim, scri, crim
scrip, s, c, r, i, p, sc, cr, ri, ip, scr, cri, rip, scri, crip
scrod, s, c, r, o, d, sc, cr, ro, od, scr, cro, rod, scro, crod
scrub, s, c, r, u, b, sc, cr, ru, ub, scr, cru, rub, scru, crub
scrum, s, c, r, u, m, sc, cr, ru, um, scr, cru, rum, scru, crum
scuba, s, c, u, b, a, sc, cu, ub, ba, scu, cub, uba, scub, cuba
scudi, s, c, u, d, i, sc, cu, ud, di, scu, cud, udi, scud, cudi
scudo, s, c, u, d, o, sc, cu, ud, do, scu, cud, udo, scud, cudo
scuds, s, c, u, d, s, sc, cu, ud, ds, scu, cud, uds, scud, cuds
scuff, s, c, u, f, f, sc, cu, uf, ff, scu, cuf, uff, scuf, cuff
sculk, s, c, u, l, k, sc, cu, ul, lk, scu, cul, ulk, scul, culk
scull, s, c, u, l, l, sc, cu, ul, ll, scu, cul, ull, scul, cull
sculp, s, c, u, l, p, sc, cu, ul, lp, scu, cul, ulp, scul, culp
scums, s, c, u, m, s, sc, cu, um, ms, scu, cum, ums, scum, cums
scups, s, c, u, p, s, sc, cu, up, ps, scu, cup, ups, scup, cups
scurf, s, c, u, r, f, sc, cu, ur, rf, scu, cur, urf, scur, curf
scuta, s, c, u, t, a, sc, cu, ut, ta, scu, cut, uta, scut, cuta
scute, s, c, u, t, e, sc, cu, ut, te, scu, cut, ute, scut, cute
scuts, s, c, u, t, s, sc, cu, ut, ts, scu, cut, uts, scut, cuts
scuzz, s, c, u, z, z, sc, cu, uz, zz, scu, cuz, uzz, scuz, cuzz
seals, s, e, a, l, s, se, ea, al, ls, sea, eal, als, seal, eals
seams, s, e, a, m, s, se, ea, am, ms, sea, eam, ams, seam, eams
seamy, s, e, a, m, y, se, ea, am, my, sea, eam, amy, seam, eamy
sears, s, e, a, r, s, se, ea, ar, rs, sea, ear, ars, sear, ears
seats, s, e, a, t, s, se, ea, at, ts, sea, eat, ats, seat, eats
sebum, s, e, b, u, m, se, eb, bu, um, seb, ebu, bum, sebu, ebum
secco, s, e, c, c, o, se, ec, cc, co, sec, ecc, cco, secc, ecco
sects, s, e, c, t, s, se, ec, ct, ts, sec, ect, cts, sect, ects
sedan, s, e, d, a, n, se, ed, da, an, sed, eda, dan, seda, edan
seder, s, e, d, e, r, se, ed, de, er, sed, ede, der, sede, eder
sedge, s, e, d, g, e, se, ed, dg, ge, sed, edg, dge, sedg, edge
sedgy, s, e, d, g, y, se, ed, dg, gy, sed, edg, dgy, sedg, edgy
sedum, s, e, d, u, m, se, ed, du, um, sed, edu, dum, sedu, edum
seeds, s, e, e, d, s, se, ee, ed, ds, see, eed, eds, seed, eeds
seedy, s, e, e, d, y, se, ee, ed, dy, see, eed, edy, seed, eedy
seeks, s, e, e, k, s, se, ee, ek, ks, see, eek, eks, seek, eeks
seels, s, e, e, l, s, se, ee, el, ls, see, eel, els, seel, eels
seely, s, e, e, l, y, se, ee, el, ly, see, eel, ely, seel, eely
seems, s, e, e, m, s, se, ee, em, ms, see, eem, ems, seem, eems
seeps, s, e, e, p, s, se, ee, ep, ps, see, eep, eps, seep, eeps
seepy, s, e, e, p, y, se, ee, ep, py, see, eep, epy, seep, eepy
seers, s, e, e, r, s, se, ee, er, rs, see, eer, ers, seer, eers
segni, s, e, g, n, i, se, eg, gn, ni, seg, egn, gni, segn, egni
segno, s, e, g, n, o, se, eg, gn, no, seg, egn, gno, segn, egno
segos, s, e, g, o, s, se, eg, go, os, seg, ego, gos, sego, egos
segue, s, e, g, u, e, se, eg, gu, ue, seg, egu, gue, segu, egue
seifs, s, e, i, f, s, se, ei, if, fs, sei, eif, ifs, seif, eifs
seine, s, e, i, n, e, se, ei, in, ne, sei, ein, ine, sein, eine
seise, s, e, i, s, e, se, ei, is, se, sei, eis, ise, seis, eise
seism, s, e, i, s, m, se, ei, is, sm, sei, eis, ism, seis, eism
seize, s, e, i, z, e, se, ei, iz, ze, sei, eiz, ize, seiz, eize
selah, s, e, l, a, h, se, el, la, ah, sel, ela, lah, sela, elah
selfs, s, e, l, f, s, se, el, lf, fs, sel, elf, lfs, self, elfs
selle, s, e, l, l, e, se, el, ll, le, sel, ell, lle, sell, elle
sells, s, e, l, l, s, se, el, ll, ls, sel, ell, lls, sell, ells
selva, s, e, l, v, a, se, el, lv, va, sel, elv, lva, selv, elva
semen, s, e, m, e, n, se, em, me, en, sem, eme, men, seme, emen
semes, s, e, m, e, s, se, em, me, es, sem, eme, mes, seme, emes
semis, s, e, m, i, s, se, em, mi, is, sem, emi, mis, semi, emis
sends, s, e, n, d, s, se, en, nd, ds, sen, end, nds, send, ends
sengi, s, e, n, g, i, se, en, ng, gi, sen, eng, ngi, seng, engi
senna, s, e, n, n, a, se, en, nn, na, sen, enn, nna, senn, enna
senor, s, e, n, o, r, se, en, no, or, sen, eno, nor, seno, enor
sensa, s, e, n, s, a, se, en, ns, sa, sen, ens, nsa, sens, ensa
sense, s, e, n, s, e, se, en, ns, se, sen, ens, nse, sens, ense
sente, s, e, n, t, e, se, en, nt, te, sen, ent, nte, sent, ente
senti, s, e, n, t, i, se, en, nt, ti, sen, ent, nti, sent, enti
sepal, s, e, p, a, l, se, ep, pa, al, sep, epa, pal, sepa, epal
sepia, s, e, p, i, a, se, ep, pi, ia, sep, epi, pia, sepi, epia
sepic, s, e, p, i, c, se, ep, pi, ic, sep, epi, pic, sepi, epic
sepoy, s, e, p, o, y, se, ep, po, oy, sep, epo, poy, sepo, epoy
septa, s, e, p, t, a, se, ep, pt, ta, sep, ept, pta, sept, epta
septs, s, e, p, t, s, se, ep, pt, ts, sep, ept, pts, sept, epts
serac, s, e, r, a, c, se, er, ra, ac, ser, era, rac, sera, erac
serai, s, e, r, a, i, se, er, ra, ai, ser, era, rai, sera, erai
seral, s, e, r, a, l, se, er, ra, al, ser, era, ral, sera, eral
sered, s, e, r, e, d, se, er, re, ed, ser, ere, red, sere, ered
serer, s, e, r, e, r, se, er, re, er, ser, ere, rer, sere, erer
seres, s, e, r, e, s, se, er, re, es, ser, ere, res, sere, eres
serfs, s, e, r, f, s, se, er, rf, fs, ser, erf, rfs, serf, erfs
serge, s, e, r, g, e, se, er, rg, ge, ser, erg, rge, serg, erge
serif, s, e, r, i, f, se, er, ri, if, ser, eri, rif, seri, erif
serin, s, e, r, i, n, se, er, ri, in, ser, eri, rin, seri, erin
serow, s, e, r, o, w, se, er, ro, ow, ser, ero, row, sero, erow
serry, s, e, r, r, y, se, er, rr, ry, ser, err, rry, serr, erry
serum, s, e, r, u, m, se, er, ru, um, ser, eru, rum, seru, erum
serve, s, e, r, v, e, se, er, rv, ve, ser, erv, rve, serv, erve
servo, s, e, r, v, o, se, er, rv, vo, ser, erv, rvo, serv, ervo
setae, s, e, t, a, e, se, et, ta, ae, set, eta, tae, seta, etae
setal, s, e, t, a, l, se, et, ta, al, set, eta, tal, seta, etal
seton, s, e, t, o, n, se, et, to, on, set, eto, ton, seto, eton
setts, s, e, t, t, s, se, et, tt, ts, set, ett, tts, sett, etts
setup, s, e, t, u, p, se, et, tu, up, set, etu, tup, setu, etup
seven, s, e, v, e, n, se, ev, ve, en, sev, eve, ven, seve, even
sever, s, e, v, e, r, se, ev, ve, er, sev, eve, ver, seve, ever
sewan, s, e, w, a, n, se, ew, wa, an, sew, ewa, wan, sewa, ewan
sewar, s, e, w, a, r, se, ew, wa, ar, sew, ewa, war, sewa, ewar
sewed, s, e, w, e, d, se, ew, we, ed, sew, ewe, wed, sewe, ewed
sewer, s, e, w, e, r, se, ew, we, er, sew, ewe, wer, sewe, ewer
sexed, s, e, x, e, d, se, ex, xe, ed, sex, exe, xed, sexe, exed
sexes, s, e, x, e, s, se, ex, xe, es, sex, exe, xes, sexe, exes
sexto, s, e, x, t, o, se, ex, xt, to, sex, ext, xto, sext, exto
sexts, s, e, x, t, s, se, ex, xt, ts, sex, ext, xts, sext, exts
shack, s, h, a, c, k, sh, ha, ac, ck, sha, hac, ack, shac, hack
shade, s, h, a, d, e, sh, ha, ad, de, sha, had, ade, shad, hade
shads, s, h, a, d, s, sh, ha, ad, ds, sha, had, ads, shad, hads
shady, s, h, a, d, y, sh, ha, ad, dy, sha, had, ady, shad, hady
shaft, s, h, a, f, t, sh, ha, af, ft, sha, haf, aft, shaf, haft
shags, s, h, a, g, s, sh, ha, ag, gs, sha, hag, ags, shag, hags
shahs, s, h, a, h, s, sh, ha, ah, hs, sha, hah, ahs, shah, hahs
shake, s, h, a, k, e, sh, ha, ak, ke, sha, hak, ake, shak, hake
shako, s, h, a, k, o, sh, ha, ak, ko, sha, hak, ako, shak, hako
shaky, s, h, a, k, y, sh, ha, ak, ky, sha, hak, aky, shak, haky
shale, s, h, a, l, e, sh, ha, al, le, sha, hal, ale, shal, hale
shall, s, h, a, l, l, sh, ha, al, ll, sha, hal, all, shal, hall
shalt, s, h, a, l, t, sh, ha, al, lt, sha, hal, alt, shal, halt
shaly, s, h, a, l, y, sh, ha, al, ly, sha, hal, aly, shal, haly
shame, s, h, a, m, e, sh, ha, am, me, sha, ham, ame, sham, hame
shams, s, h, a, m, s, sh, ha, am, ms, sha, ham, ams, sham, hams
shank, s, h, a, n, k, sh, ha, an, nk, sha, han, ank, shan, hank
shape, s, h, a, p, e, sh, ha, ap, pe, sha, hap, ape, shap, hape
shard, s, h, a, r, d, sh, ha, ar, rd, sha, har, ard, shar, hard
share, s, h, a, r, e, sh, ha, ar, re, sha, har, are, shar, hare
shark, s, h, a, r, k, sh, ha, ar, rk, sha, har, ark, shar, hark
sharn, s, h, a, r, n, sh, ha, ar, rn, sha, har, arn, shar, harn
sharp, s, h, a, r, p, sh, ha, ar, rp, sha, har, arp, shar, harp
shaul, s, h, a, u, l, sh, ha, au, ul, sha, hau, aul, shau, haul
shave, s, h, a, v, e, sh, ha, av, ve, sha, hav, ave, shav, have
shawl, s, h, a, w, l, sh, ha, aw, wl, sha, haw, awl, shaw, hawl
shawm, s, h, a, w, m, sh, ha, aw, wm, sha, haw, awm, shaw, hawm
shawn, s, h, a, w, n, sh, ha, aw, wn, sha, haw, awn, shaw, hawn
shaws, s, h, a, w, s, sh, ha, aw, ws, sha, haw, aws, shaw, haws
shays, s, h, a, y, s, sh, ha, ay, ys, sha, hay, ays, shay, hays
sheaf, s, h, e, a, f, sh, he, ea, af, she, hea, eaf, shea, heaf
sheal, s, h, e, a, l, sh, he, ea, al, she, hea, eal, shea, heal
shear, s, h, e, a, r, sh, he, ea, ar, she, hea, ear, shea, hear
sheas, s, h, e, a, s, sh, he, ea, as, she, hea, eas, shea, heas
sheds, s, h, e, d, s, sh, he, ed, ds, she, hed, eds, shed, heds
sheen, s, h, e, e, n, sh, he, ee, en, she, hee, een, shee, heen
sheep, s, h, e, e, p, sh, he, ee, ep, she, hee, eep, shee, heep
sheer, s, h, e, e, r, sh, he, ee, er, she, hee, eer, shee, heer
sheet, s, h, e, e, t, sh, he, ee, et, she, hee, eet, shee, heet
sheik, s, h, e, i, k, sh, he, ei, ik, she, hei, eik, shei, heik
shelf, s, h, e, l, f, sh, he, el, lf, she, hel, elf, shel, helf
shell, s, h, e, l, l, sh, he, el, ll, she, hel, ell, shel, hell
shend, s, h, e, n, d, sh, he, en, nd, she, hen, end, shen, hend
shent, s, h, e, n, t, sh, he, en, nt, she, hen, ent, shen, hent
sheol, s, h, e, o, l, sh, he, eo, ol, she, heo, eol, sheo, heol
sherd, s, h, e, r, d, sh, he, er, rd, she, her, erd, sher, herd
shewn, s, h, e, w, n, sh, he, ew, wn, she, hew, ewn, shew, hewn
shews, s, h, e, w, s, sh, he, ew, ws, she, hew, ews, shew, hews
shied, s, h, i, e, d, sh, hi, ie, ed, shi, hie, ied, shie, hied
shiel, s, h, i, e, l, sh, hi, ie, el, shi, hie, iel, shie, hiel
shier, s, h, i, e, r, sh, hi, ie, er, shi, hie, ier, shie, hier
shies, s, h, i, e, s, sh, hi, ie, es, shi, hie, ies, shie, hies
shift, s, h, i, f, t, sh, hi, if, ft, shi, hif, ift, shif, hift
shill, s, h, i, l, l, sh, hi, il, ll, shi, hil, ill, shil, hill
shily, s, h, i, l, y, sh, hi, il, ly, shi, hil, ily, shil, hily
shims, s, h, i, m, s, sh, hi, im, ms, shi, him, ims, shim, hims
shine, s, h, i, n, e, sh, hi, in, ne, shi, hin, ine, shin, hine
shins, s, h, i, n, s, sh, hi, in, ns, shi, hin, ins, shin, hins
shiny, s, h, i, n, y, sh, hi, in, ny, shi, hin, iny, shin, hiny
ships, s, h, i, p, s, sh, hi, ip, ps, shi, hip, ips, ship, hips
shire, s, h, i, r, e, sh, hi, ir, re, shi, hir, ire, shir, hire
shirk, s, h, i, r, k, sh, hi, ir, rk, shi, hir, irk, shir, hirk
shirr, s, h, i, r, r, sh, hi, ir, rr, shi, hir, irr, shir, hirr
shirt, s, h, i, r, t, sh, hi, ir, rt, shi, hir, irt, shir, hirt
shist, s, h, i, s, t, sh, hi, is, st, shi, his, ist, shis, hist
shits, s, h, i, t, s, sh, hi, it, ts, shi, hit, its, shit, hits
shiva, s, h, i, v, a, sh, hi, iv, va, shi, hiv, iva, shiv, hiva
shive, s, h, i, v, e, sh, hi, iv, ve, shi, hiv, ive, shiv, hive
shivs, s, h, i, v, s, sh, hi, iv, vs, shi, hiv, ivs, shiv, hivs
shlep, s, h, l, e, p, sh, hl, le, ep, shl, hle, lep, shle, hlep
shlub, s, h, l, u, b, sh, hl, lu, ub, shl, hlu, lub, shlu, hlub
shoal, s, h, o, a, l, sh, ho, oa, al, sho, hoa, oal, shoa, hoal
shoat, s, h, o, a, t, sh, ho, oa, at, sho, hoa, oat, shoa, hoat
shock, s, h, o, c, k, sh, ho, oc, ck, sho, hoc, ock, shoc, hock
shoed, s, h, o, e, d, sh, ho, oe, ed, sho, hoe, oed, shoe, hoed
shoer, s, h, o, e, r, sh, ho, oe, er, sho, hoe, oer, shoe, hoer
shoes, s, h, o, e, s, sh, ho, oe, es, sho, hoe, oes, shoe, hoes
shogi, s, h, o, g, i, sh, ho, og, gi, sho, hog, ogi, shog, hogi
shogs, s, h, o, g, s, sh, ho, og, gs, sho, hog, ogs, shog, hogs
shoji, s, h, o, j, i, sh, ho, oj, ji, sho, hoj, oji, shoj, hoji
shone, s, h, o, n, e, sh, ho, on, ne, sho, hon, one, shon, hone
shook, s, h, o, o, k, sh, ho, oo, ok, sho, hoo, ook, shoo, hook
shool, s, h, o, o, l, sh, ho, oo, ol, sho, hoo, ool, shoo, hool
shoon, s, h, o, o, n, sh, ho, oo, on, sho, hoo, oon, shoo, hoon
shoos, s, h, o, o, s, sh, ho, oo, os, sho, hoo, oos, shoo, hoos
shoot, s, h, o, o, t, sh, ho, oo, ot, sho, hoo, oot, shoo, hoot
shops, s, h, o, p, s, sh, ho, op, ps, sho, hop, ops, shop, hops
shore, s, h, o, r, e, sh, ho, or, re, sho, hor, ore, shor, hore
shorl, s, h, o, r, l, sh, ho, or, rl, sho, hor, orl, shor, horl
shorn, s, h, o, r, n, sh, ho, or, rn, sho, hor, orn, shor, horn
short, s, h, o, r, t, sh, ho, or, rt, sho, hor, ort, shor, hort
shote, s, h, o, t, e, sh, ho, ot, te, sho, hot, ote, shot, hote
shots, s, h, o, t, s, sh, ho, ot, ts, sho, hot, ots, shot, hots
shott, s, h, o, t, t, sh, ho, ot, tt, sho, hot, ott, shot, hott
shout, s, h, o, u, t, sh, ho, ou, ut, sho, hou, out, shou, hout
shove, s, h, o, v, e, sh, ho, ov, ve, sho, hov, ove, shov, hove
shown, s, h, o, w, n, sh, ho, ow, wn, sho, how, own, show, hown
shows, s, h, o, w, s, sh, ho, ow, ws, sho, how, ows, show, hows
showy, s, h, o, w, y, sh, ho, ow, wy, sho, how, owy, show, howy
shoyu, s, h, o, y, u, sh, ho, oy, yu, sho, hoy, oyu, shoy, hoyu
shred, s, h, r, e, d, sh, hr, re, ed, shr, hre, red, shre, hred
shrew, s, h, r, e, w, sh, hr, re, ew, shr, hre, rew, shre, hrew
shris, s, h, r, i, s, sh, hr, ri, is, shr, hri, ris, shri, hris
shrub, s, h, r, u, b, sh, hr, ru, ub, shr, hru, rub, shru, hrub
shrug, s, h, r, u, g, sh, hr, ru, ug, shr, hru, rug, shru, hrug
shtik, s, h, t, i, k, sh, ht, ti, ik, sht, hti, tik, shti, htik
shuck, s, h, u, c, k, sh, hu, uc, ck, shu, huc, uck, shuc, huck
shuln, s, h, u, l, n, sh, hu, ul, ln, shu, hul, uln, shul, huln
shuls, s, h, u, l, s, sh, hu, ul, ls, shu, hul, uls, shul, huls
shuns, s, h, u, n, s, sh, hu, un, ns, shu, hun, uns, shun, huns
