wordList, str1, str2, str3, str4, str5, str12, str23, str34, str45, str123, str234, str345, str1234, str2345
aahed, a, a, h, e, d, aa, ah, he, ed, aah, ahe, hed, aahe, ahed
aalii, a, a, l, i, i, aa, al, li, ii, aal, ali, lii, aali, alii
aargh, a, a, r, g, h, aa, ar, rg, gh, aar, arg, rgh, aarg, argh
abaca, a, b, a, c, a, ab, ba, ac, ca, aba, bac, aca, abac, baca
abaci, a, b, a, c, i, ab, ba, ac, ci, aba, bac, aci, abac, baci
aback, a, b, a, c, k, ab, ba, ac, ck, aba, bac, ack, abac, back
abaft, a, b, a, f, t, ab, ba, af, ft, aba, baf, aft, abaf, baft
abaka, a, b, a, k, a, ab, ba, ak, ka, aba, bak, aka, abak, baka
abamp, a, b, a, m, p, ab, ba, am, mp, aba, bam, amp, abam, bamp
abase, a, b, a, s, e, ab, ba, as, se, aba, bas, ase, abas, base
abash, a, b, a, s, h, ab, ba, as, sh, aba, bas, ash, abas, bash
abate, a, b, a, t, e, ab, ba, at, te, aba, bat, ate, abat, bate
abaya, a, b, a, y, a, ab, ba, ay, ya, aba, bay, aya, abay, baya
abbas, a, b, b, a, s, ab, bb, ba, as, abb, bba, bas, abba, bbas
abbes, a, b, b, e, s, ab, bb, be, es, abb, bbe, bes, abbe, bbes
abbey, a, b, b, e, y, ab, bb, be, ey, abb, bbe, bey, abbe, bbey
abbot, a, b, b, o, t, ab, bb, bo, ot, abb, bbo, bot, abbo, bbot
abeam, a, b, e, a, m, ab, be, ea, am, abe, bea, eam, abea, beam
abele, a, b, e, l, e, ab, be, el, le, abe, bel, ele, abel, bele
abets, a, b, e, t, s, ab, be, et, ts, abe, bet, ets, abet, bets
abhor, a, b, h, o, r, ab, bh, ho, or, abh, bho, hor, abho, bhor
abide, a, b, i, d, e, ab, bi, id, de, abi, bid, ide, abid, bide
abled, a, b, l, e, d, ab, bl, le, ed, abl, ble, led, able, bled
abler, a, b, l, e, r, ab, bl, le, er, abl, ble, ler, able, bler
ables, a, b, l, e, s, ab, bl, le, es, abl, ble, les, able, bles
abmho, a, b, m, h, o, ab, bm, mh, ho, abm, bmh, mho, abmh, bmho
abode, a, b, o, d, e, ab, bo, od, de, abo, bod, ode, abod, bode
abohm, a, b, o, h, m, ab, bo, oh, hm, abo, boh, ohm, aboh, bohm
aboil, a, b, o, i, l, ab, bo, oi, il, abo, boi, oil, aboi, boil
aboma, a, b, o, m, a, ab, bo, om, ma, abo, bom, oma, abom, boma
aboon, a, b, o, o, n, ab, bo, oo, on, abo, boo, oon, aboo, boon
abort, a, b, o, r, t, ab, bo, or, rt, abo, bor, ort, abor, bort
about, a, b, o, u, t, ab, bo, ou, ut, abo, bou, out, abou, bout
above, a, b, o, v, e, ab, bo, ov, ve, abo, bov, ove, abov, bove
abris, a, b, r, i, s, ab, br, ri, is, abr, bri, ris, abri, bris
abuse, a, b, u, s, e, ab, bu, us, se, abu, bus, use, abus, buse
abuts, a, b, u, t, s, ab, bu, ut, ts, abu, but, uts, abut, buts
abuzz, a, b, u, z, z, ab, bu, uz, zz, abu, buz, uzz, abuz, buzz
abyes, a, b, y, e, s, ab, by, ye, es, aby, bye, yes, abye, byes
abysm, a, b, y, s, m, ab, by, ys, sm, aby, bys, ysm, abys, bysm
abyss, a, b, y, s, s, ab, by, ys, ss, aby, bys, yss, abys, byss
acari, a, c, a, r, i, ac, ca, ar, ri, aca, car, ari, acar, cari
acerb, a, c, e, r, b, ac, ce, er, rb, ace, cer, erb, acer, cerb
aceta, a, c, e, t, a, ac, ce, et, ta, ace, cet, eta, acet, ceta
ached, a, c, h, e, d, ac, ch, he, ed, ach, che, hed, ache, ched
aches, a, c, h, e, s, ac, ch, he, es, ach, che, hes, ache, ches
achoo, a, c, h, o, o, ac, ch, ho, oo, ach, cho, hoo, acho, choo
acids, a, c, i, d, s, ac, ci, id, ds, aci, cid, ids, acid, cids
acidy, a, c, i, d, y, ac, ci, id, dy, aci, cid, idy, acid, cidy
acing, a, c, i, n, g, ac, ci, in, ng, aci, cin, ing, acin, cing
acini, a, c, i, n, i, ac, ci, in, ni, aci, cin, ini, acin, cini
ackee, a, c, k, e, e, ac, ck, ke, ee, ack, cke, kee, acke, ckee
acmes, a, c, m, e, s, ac, cm, me, es, acm, cme, mes, acme, cmes
acmic, a, c, m, i, c, ac, cm, mi, ic, acm, cmi, mic, acmi, cmic
acned, a, c, n, e, d, ac, cn, ne, ed, acn, cne, ned, acne, cned
acnes, a, c, n, e, s, ac, cn, ne, es, acn, cne, nes, acne, cnes
acock, a, c, o, c, k, ac, co, oc, ck, aco, coc, ock, acoc, cock
acold, a, c, o, l, d, ac, co, ol, ld, aco, col, old, acol, cold
acorn, a, c, o, r, n, ac, co, or, rn, aco, cor, orn, acor, corn
acred, a, c, r, e, d, ac, cr, re, ed, acr, cre, red, acre, cred
acres, a, c, r, e, s, ac, cr, re, es, acr, cre, res, acre, cres
acrid, a, c, r, i, d, ac, cr, ri, id, acr, cri, rid, acri, crid
acted, a, c, t, e, d, ac, ct, te, ed, act, cte, ted, acte, cted
actin, a, c, t, i, n, ac, ct, ti, in, act, cti, tin, acti, ctin
actor, a, c, t, o, r, ac, ct, to, or, act, cto, tor, acto, ctor
acute, a, c, u, t, e, ac, cu, ut, te, acu, cut, ute, acut, cute
acyls, a, c, y, l, s, ac, cy, yl, ls, acy, cyl, yls, acyl, cyls
adage, a, d, a, g, e, ad, da, ag, ge, ada, dag, age, adag, dage
adapt, a, d, a, p, t, ad, da, ap, pt, ada, dap, apt, adap, dapt
addax, a, d, d, a, x, ad, dd, da, ax, add, dda, dax, adda, ddax
added, a, d, d, e, d, ad, dd, de, ed, add, dde, ded, adde, dded
adder, a, d, d, e, r, ad, dd, de, er, add, dde, der, adde, dder
addle, a, d, d, l, e, ad, dd, dl, le, add, ddl, dle, addl, ddle
adeem, a, d, e, e, m, ad, de, ee, em, ade, dee, eem, adee, deem
adept, a, d, e, p, t, ad, de, ep, pt, ade, dep, ept, adep, dept
adieu, a, d, i, e, u, ad, di, ie, eu, adi, die, ieu, adie, dieu
adios, a, d, i, o, s, ad, di, io, os, adi, dio, ios, adio, dios
adits, a, d, i, t, s, ad, di, it, ts, adi, dit, its, adit, dits
adman, a, d, m, a, n, ad, dm, ma, an, adm, dma, man, adma, dman
admen, a, d, m, e, n, ad, dm, me, en, adm, dme, men, adme, dmen
admit, a, d, m, i, t, ad, dm, mi, it, adm, dmi, mit, admi, dmit
admix, a, d, m, i, x, ad, dm, mi, ix, adm, dmi, mix, admi, dmix
adobe, a, d, o, b, e, ad, do, ob, be, ado, dob, obe, adob, dobe
adobo, a, d, o, b, o, ad, do, ob, bo, ado, dob, obo, adob, dobo
adopt, a, d, o, p, t, ad, do, op, pt, ado, dop, opt, adop, dopt
adore, a, d, o, r, e, ad, do, or, re, ado, dor, ore, ador, dore
adorn, a, d, o, r, n, ad, do, or, rn, ado, dor, orn, ador, dorn
adown, a, d, o, w, n, ad, do, ow, wn, ado, dow, own, adow, down
adoze, a, d, o, z, e, ad, do, oz, ze, ado, doz, oze, adoz, doze
adult, a, d, u, l, t, ad, du, ul, lt, adu, dul, ult, adul, dult
adunc, a, d, u, n, c, ad, du, un, nc, adu, dun, unc, adun, dunc
adust, a, d, u, s, t, ad, du, us, st, adu, dus, ust, adus, dust
adyta, a, d, y, t, a, ad, dy, yt, ta, ady, dyt, yta, adyt, dyta
adzed, a, d, z, e, d, ad, dz, ze, ed, adz, dze, zed, adze, dzed
adzes, a, d, z, e, s, ad, dz, ze, es, adz, dze, zes, adze, dzes
aecia, a, e, c, i, a, ae, ec, ci, ia, aec, eci, cia, aeci, ecia
aedes, a, e, d, e, s, ae, ed, de, es, aed, ede, des, aede, edes
aegis, a, e, g, i, s, ae, eg, gi, is, aeg, egi, gis, aegi, egis
aeons, a, e, o, n, s, ae, eo, on, ns, aeo, eon, ons, aeon, eons
aerie, a, e, r, i, e, ae, er, ri, ie, aer, eri, rie, aeri, erie
afars, a, f, a, r, s, af, fa, ar, rs, afa, far, ars, afar, fars
affix, a, f, f, i, x, af, ff, fi, ix, aff, ffi, fix, affi, ffix
afire, a, f, i, r, e, af, fi, ir, re, afi, fir, ire, afir, fire
afoot, a, f, o, o, t, af, fo, oo, ot, afo, foo, oot, afoo, foot
afore, a, f, o, r, e, af, fo, or, re, afo, for, ore, afor, fore
afoul, a, f, o, u, l, af, fo, ou, ul, afo, fou, oul, afou, foul
afrit, a, f, r, i, t, af, fr, ri, it, afr, fri, rit, afri, frit
after, a, f, t, e, r, af, ft, te, er, aft, fte, ter, afte, fter
again, a, g, a, i, n, ag, ga, ai, in, aga, gai, ain, agai, gain
agama, a, g, a, m, a, ag, ga, am, ma, aga, gam, ama, agam, gama
agape, a, g, a, p, e, ag, ga, ap, pe, aga, gap, ape, agap, gape
agars, a, g, a, r, s, ag, ga, ar, rs, aga, gar, ars, agar, gars
agate, a, g, a, t, e, ag, ga, at, te, aga, gat, ate, agat, gate
agave, a, g, a, v, e, ag, ga, av, ve, aga, gav, ave, agav, gave
agaze, a, g, a, z, e, ag, ga, az, ze, aga, gaz, aze, agaz, gaze
agene, a, g, e, n, e, ag, ge, en, ne, age, gen, ene, agen, gene
agent, a, g, e, n, t, ag, ge, en, nt, age, gen, ent, agen, gent
agers, a, g, e, r, s, ag, ge, er, rs, age, ger, ers, ager, gers
agger, a, g, g, e, r, ag, gg, ge, er, agg, gge, ger, agge, gger
aggie, a, g, g, i, e, ag, gg, gi, ie, agg, ggi, gie, aggi, ggie
aggro, a, g, g, r, o, ag, gg, gr, ro, agg, ggr, gro, aggr, ggro
aghas, a, g, h, a, s, ag, gh, ha, as, agh, gha, has, agha, ghas
agile, a, g, i, l, e, ag, gi, il, le, agi, gil, ile, agil, gile
aging, a, g, i, n, g, ag, gi, in, ng, agi, gin, ing, agin, ging
agios, a, g, i, o, s, ag, gi, io, os, agi, gio, ios, agio, gios
agism, a, g, i, s, m, ag, gi, is, sm, agi, gis, ism, agis, gism
agist, a, g, i, s, t, ag, gi, is, st, agi, gis, ist, agis, gist
agita, a, g, i, t, a, ag, gi, it, ta, agi, git, ita, agit, gita
aglee, a, g, l, e, e, ag, gl, le, ee, agl, gle, lee, agle, glee
aglet, a, g, l, e, t, ag, gl, le, et, agl, gle, let, agle, glet
agley, a, g, l, e, y, ag, gl, le, ey, agl, gle, ley, agle, gley
aglow, a, g, l, o, w, ag, gl, lo, ow, agl, glo, low, aglo, glow
agmas, a, g, m, a, s, ag, gm, ma, as, agm, gma, mas, agma, gmas
agone, a, g, o, n, e, ag, go, on, ne, ago, gon, one, agon, gone
agons, a, g, o, n, s, ag, go, on, ns, ago, gon, ons, agon, gons
agony, a, g, o, n, y, ag, go, on, ny, ago, gon, ony, agon, gony
agora, a, g, o, r, a, ag, go, or, ra, ago, gor, ora, agor, gora
agree, a, g, r, e, e, ag, gr, re, ee, agr, gre, ree, agre, gree
agria, a, g, r, i, a, ag, gr, ri, ia, agr, gri, ria, agri, gria
agues, a, g, u, e, s, ag, gu, ue, es, agu, gue, ues, ague, gues
ahead, a, h, e, a, d, ah, he, ea, ad, ahe, hea, ead, ahea, head
ahing, a, h, i, n, g, ah, hi, in, ng, ahi, hin, ing, ahin, hing
ahold, a, h, o, l, d, ah, ho, ol, ld, aho, hol, old, ahol, hold
ahull, a, h, u, l, l, ah, hu, ul, ll, ahu, hul, ull, ahul, hull
aided, a, i, d, e, d, ai, id, de, ed, aid, ide, ded, aide, ided
aider, a, i, d, e, r, ai, id, de, er, aid, ide, der, aide, ider
aides, a, i, d, e, s, ai, id, de, es, aid, ide, des, aide, ides
ailed, a, i, l, e, d, ai, il, le, ed, ail, ile, led, aile, iled
aimed, a, i, m, e, d, ai, im, me, ed, aim, ime, med, aime, imed
aimer, a, i, m, e, r, ai, im, me, er, aim, ime, mer, aime, imer
aioli, a, i, o, l, i, ai, io, ol, li, aio, iol, oli, aiol, ioli
aired, a, i, r, e, d, ai, ir, re, ed, air, ire, red, aire, ired
airer, a, i, r, e, r, ai, ir, re, er, air, ire, rer, aire, irer
airns, a, i, r, n, s, ai, ir, rn, ns, air, irn, rns, airn, irns
airth, a, i, r, t, h, ai, ir, rt, th, air, irt, rth, airt, irth
airts, a, i, r, t, s, ai, ir, rt, ts, air, irt, rts, airt, irts
aisle, a, i, s, l, e, ai, is, sl, le, ais, isl, sle, aisl, isle
aitch, a, i, t, c, h, ai, it, tc, ch, ait, itc, tch, aitc, itch
aiver, a, i, v, e, r, ai, iv, ve, er, aiv, ive, ver, aive, iver
ajiva, a, j, i, v, a, aj, ji, iv, va, aji, jiv, iva, ajiv, jiva
ajuga, a, j, u, g, a, aj, ju, ug, ga, aju, jug, uga, ajug, juga
akees, a, k, e, e, s, ak, ke, ee, es, ake, kee, ees, akee, kees
akela, a, k, e, l, a, ak, ke, el, la, ake, kel, ela, akel, kela
akene, a, k, e, n, e, ak, ke, en, ne, ake, ken, ene, aken, kene
alack, a, l, a, c, k, al, la, ac, ck, ala, lac, ack, alac, lack
alamo, a, l, a, m, o, al, la, am, mo, ala, lam, amo, alam, lamo
aland, a, l, a, n, d, al, la, an, nd, ala, lan, and, alan, land
alane, a, l, a, n, e, al, la, an, ne, ala, lan, ane, alan, lane
alang, a, l, a, n, g, al, la, an, ng, ala, lan, ang, alan, lang
alans, a, l, a, n, s, al, la, an, ns, ala, lan, ans, alan, lans
alant, a, l, a, n, t, al, la, an, nt, ala, lan, ant, alan, lant
alarm, a, l, a, r, m, al, la, ar, rm, ala, lar, arm, alar, larm
alary, a, l, a, r, y, al, la, ar, ry, ala, lar, ary, alar, lary
alate, a, l, a, t, e, al, la, at, te, ala, lat, ate, alat, late
albas, a, l, b, a, s, al, lb, ba, as, alb, lba, bas, alba, lbas
album, a, l, b, u, m, al, lb, bu, um, alb, lbu, bum, albu, lbum
alcid, a, l, c, i, d, al, lc, ci, id, alc, lci, cid, alci, lcid
alder, a, l, d, e, r, al, ld, de, er, ald, lde, der, alde, lder
aldol, a, l, d, o, l, al, ld, do, ol, ald, ldo, dol, aldo, ldol
alecs, a, l, e, c, s, al, le, ec, cs, ale, lec, ecs, alec, lecs
alefs, a, l, e, f, s, al, le, ef, fs, ale, lef, efs, alef, lefs
aleph, a, l, e, p, h, al, le, ep, ph, ale, lep, eph, alep, leph
alert, a, l, e, r, t, al, le, er, rt, ale, ler, ert, aler, lert
alfas, a, l, f, a, s, al, lf, fa, as, alf, lfa, fas, alfa, lfas
algae, a, l, g, a, e, al, lg, ga, ae, alg, lga, gae, alga, lgae
algal, a, l, g, a, l, al, lg, ga, al, alg, lga, gal, alga, lgal
algas, a, l, g, a, s, al, lg, ga, as, alg, lga, gas, alga, lgas
algid, a, l, g, i, d, al, lg, gi, id, alg, lgi, gid, algi, lgid
algin, a, l, g, i, n, al, lg, gi, in, alg, lgi, gin, algi, lgin
algor, a, l, g, o, r, al, lg, go, or, alg, lgo, gor, algo, lgor
algum, a, l, g, u, m, al, lg, gu, um, alg, lgu, gum, algu, lgum
alias, a, l, i, a, s, al, li, ia, as, ali, lia, ias, alia, lias
alibi, a, l, i, b, i, al, li, ib, bi, ali, lib, ibi, alib, libi
alien, a, l, i, e, n, al, li, ie, en, ali, lie, ien, alie, lien
alifs, a, l, i, f, s, al, li, if, fs, ali, lif, ifs, alif, lifs
align, a, l, i, g, n, al, li, ig, gn, ali, lig, ign, alig, lign
alike, a, l, i, k, e, al, li, ik, ke, ali, lik, ike, alik, like
aline, a, l, i, n, e, al, li, in, ne, ali, lin, ine, alin, line
alist, a, l, i, s, t, al, li, is, st, ali, lis, ist, alis, list
alive, a, l, i, v, e, al, li, iv, ve, ali, liv, ive, aliv, live
aliya, a, l, i, y, a, al, li, iy, ya, ali, liy, iya, aliy, liya
alkie, a, l, k, i, e, al, lk, ki, ie, alk, lki, kie, alki, lkie
alkyd, a, l, k, y, d, al, lk, ky, yd, alk, lky, kyd, alky, lkyd
alkyl, a, l, k, y, l, al, lk, ky, yl, alk, lky, kyl, alky, lkyl
allay, a, l, l, a, y, al, ll, la, ay, all, lla, lay, alla, llay
allee, a, l, l, e, e, al, ll, le, ee, all, lle, lee, alle, llee
alley, a, l, l, e, y, al, ll, le, ey, all, lle, ley, alle, lley
allod, a, l, l, o, d, al, ll, lo, od, all, llo, lod, allo, llod
allot, a, l, l, o, t, al, ll, lo, ot, all, llo, lot, allo, llot
allow, a, l, l, o, w, al, ll, lo, ow, all, llo, low, allo, llow
alloy, a, l, l, o, y, al, ll, lo, oy, all, llo, loy, allo, lloy
allyl, a, l, l, y, l, al, ll, ly, yl, all, lly, lyl, ally, llyl
almah, a, l, m, a, h, al, lm, ma, ah, alm, lma, mah, alma, lmah
almas, a, l, m, a, s, al, lm, ma, as, alm, lma, mas, alma, lmas
almeh, a, l, m, e, h, al, lm, me, eh, alm, lme, meh, alme, lmeh
almes, a, l, m, e, s, al, lm, me, es, alm, lme, mes, alme, lmes
almud, a, l, m, u, d, al, lm, mu, ud, alm, lmu, mud, almu, lmud
almug, a, l, m, u, g, al, lm, mu, ug, alm, lmu, mug, almu, lmug
aloes, a, l, o, e, s, al, lo, oe, es, alo, loe, oes, aloe, loes
aloft, a, l, o, f, t, al, lo, of, ft, alo, lof, oft, alof, loft
aloha, a, l, o, h, a, al, lo, oh, ha, alo, loh, oha, aloh, loha
aloin, a, l, o, i, n, al, lo, oi, in, alo, loi, oin, aloi, loin
alone, a, l, o, n, e, al, lo, on, ne, alo, lon, one, alon, lone
along, a, l, o, n, g, al, lo, on, ng, alo, lon, ong, alon, long
aloof, a, l, o, o, f, al, lo, oo, of, alo, loo, oof, aloo, loof
aloud, a, l, o, u, d, al, lo, ou, ud, alo, lou, oud, alou, loud
alpha, a, l, p, h, a, al, lp, ph, ha, alp, lph, pha, alph, lpha
altar, a, l, t, a, r, al, lt, ta, ar, alt, lta, tar, alta, ltar
alter, a, l, t, e, r, al, lt, te, er, alt, lte, ter, alte, lter
altho, a, l, t, h, o, al, lt, th, ho, alt, lth, tho, alth, ltho
altos, a, l, t, o, s, al, lt, to, os, alt, lto, tos, alto, ltos
alula, a, l, u, l, a, al, lu, ul, la, alu, lul, ula, alul, lula
alums, a, l, u, m, s, al, lu, um, ms, alu, lum, ums, alum, lums
alway, a, l, w, a, y, al, lw, wa, ay, alw, lwa, way, alwa, lway
amahs, a, m, a, h, s, am, ma, ah, hs, ama, mah, ahs, amah, mahs
amain, a, m, a, i, n, am, ma, ai, in, ama, mai, ain, amai, main
amass, a, m, a, s, s, am, ma, as, ss, ama, mas, ass, amas, mass
amaze, a, m, a, z, e, am, ma, az, ze, ama, maz, aze, amaz, maze
amber, a, m, b, e, r, am, mb, be, er, amb, mbe, ber, ambe, mber
ambit, a, m, b, i, t, am, mb, bi, it, amb, mbi, bit, ambi, mbit
amble, a, m, b, l, e, am, mb, bl, le, amb, mbl, ble, ambl, mble
ambos, a, m, b, o, s, am, mb, bo, os, amb, mbo, bos, ambo, mbos
ambry, a, m, b, r, y, am, mb, br, ry, amb, mbr, bry, ambr, mbry
ameba, a, m, e, b, a, am, me, eb, ba, ame, meb, eba, ameb, meba
ameer, a, m, e, e, r, am, me, ee, er, ame, mee, eer, amee, meer
amend, a, m, e, n, d, am, me, en, nd, ame, men, end, amen, mend
amens, a, m, e, n, s, am, me, en, ns, ame, men, ens, amen, mens
ament, a, m, e, n, t, am, me, en, nt, ame, men, ent, amen, ment
amias, a, m, i, a, s, am, mi, ia, as, ami, mia, ias, amia, mias
amice, a, m, i, c, e, am, mi, ic, ce, ami, mic, ice, amic, mice
amici, a, m, i, c, i, am, mi, ic, ci, ami, mic, ici, amic, mici
amide, a, m, i, d, e, am, mi, id, de, ami, mid, ide, amid, mide
amido, a, m, i, d, o, am, mi, id, do, ami, mid, ido, amid, mido
amids, a, m, i, d, s, am, mi, id, ds, ami, mid, ids, amid, mids
amies, a, m, i, e, s, am, mi, ie, es, ami, mie, ies, amie, mies
amiga, a, m, i, g, a, am, mi, ig, ga, ami, mig, iga, amig, miga
amigo, a, m, i, g, o, am, mi, ig, go, ami, mig, igo, amig, migo
amine, a, m, i, n, e, am, mi, in, ne, ami, min, ine, amin, mine
amino, a, m, i, n, o, am, mi, in, no, ami, min, ino, amin, mino
amins, a, m, i, n, s, am, mi, in, ns, ami, min, ins, amin, mins
amirs, a, m, i, r, s, am, mi, ir, rs, ami, mir, irs, amir, mirs
amiss, a, m, i, s, s, am, mi, is, ss, ami, mis, iss, amis, miss
amity, a, m, i, t, y, am, mi, it, ty, ami, mit, ity, amit, mity
ammos, a, m, m, o, s, am, mm, mo, os, amm, mmo, mos, ammo, mmos
amnia, a, m, n, i, a, am, mn, ni, ia, amn, mni, nia, amni, mnia
amnic, a, m, n, i, c, am, mn, ni, ic, amn, mni, nic, amni, mnic
amnio, a, m, n, i, o, am, mn, ni, io, amn, mni, nio, amni, mnio
amoks, a, m, o, k, s, am, mo, ok, ks, amo, mok, oks, amok, moks
amole, a, m, o, l, e, am, mo, ol, le, amo, mol, ole, amol, mole
among, a, m, o, n, g, am, mo, on, ng, amo, mon, ong, amon, mong
amort, a, m, o, r, t, am, mo, or, rt, amo, mor, ort, amor, mort
amour, a, m, o, u, r, am, mo, ou, ur, amo, mou, our, amou, mour
amped, a, m, p, e, d, am, mp, pe, ed, amp, mpe, ped, ampe, mped
ample, a, m, p, l, e, am, mp, pl, le, amp, mpl, ple, ampl, mple
amply, a, m, p, l, y, am, mp, pl, ly, amp, mpl, ply, ampl, mply
ampul, a, m, p, u, l, am, mp, pu, ul, amp, mpu, pul, ampu, mpul
amuck, a, m, u, c, k, am, mu, uc, ck, amu, muc, uck, amuc, muck
amuse, a, m, u, s, e, am, mu, us, se, amu, mus, use, amus, muse
amyls, a, m, y, l, s, am, my, yl, ls, amy, myl, yls, amyl, myls
ancho, a, n, c, h, o, an, nc, ch, ho, anc, nch, cho, anch, ncho
ancon, a, n, c, o, n, an, nc, co, on, anc, nco, con, anco, ncon
andro, a, n, d, r, o, an, nd, dr, ro, and, ndr, dro, andr, ndro
anear, a, n, e, a, r, an, ne, ea, ar, ane, nea, ear, anea, near
anele, a, n, e, l, e, an, ne, el, le, ane, nel, ele, anel, nele
anent, a, n, e, n, t, an, ne, en, nt, ane, nen, ent, anen, nent
angas, a, n, g, a, s, an, ng, ga, as, ang, nga, gas, anga, ngas
angel, a, n, g, e, l, an, ng, ge, el, ang, nge, gel, ange, ngel
anger, a, n, g, e, r, an, ng, ge, er, ang, nge, ger, ange, nger
angle, a, n, g, l, e, an, ng, gl, le, ang, ngl, gle, angl, ngle
anglo, a, n, g, l, o, an, ng, gl, lo, ang, ngl, glo, angl, nglo
angry, a, n, g, r, y, an, ng, gr, ry, ang, ngr, gry, angr, ngry
angst, a, n, g, s, t, an, ng, gs, st, ang, ngs, gst, angs, ngst
anile, a, n, i, l, e, an, ni, il, le, ani, nil, ile, anil, nile
anils, a, n, i, l, s, an, ni, il, ls, ani, nil, ils, anil, nils
anima, a, n, i, m, a, an, ni, im, ma, ani, nim, ima, anim, nima
anime, a, n, i, m, e, an, ni, im, me, ani, nim, ime, anim, nime
animi, a, n, i, m, i, an, ni, im, mi, ani, nim, imi, anim, nimi
anion, a, n, i, o, n, an, ni, io, on, ani, nio, ion, anio, nion
anise, a, n, i, s, e, an, ni, is, se, ani, nis, ise, anis, nise
ankhs, a, n, k, h, s, an, nk, kh, hs, ank, nkh, khs, ankh, nkhs
ankle, a, n, k, l, e, an, nk, kl, le, ank, nkl, kle, ankl, nkle
ankus, a, n, k, u, s, an, nk, ku, us, ank, nku, kus, anku, nkus
anlas, a, n, l, a, s, an, nl, la, as, anl, nla, las, anla, nlas
annal, a, n, n, a, l, an, nn, na, al, ann, nna, nal, anna, nnal
annas, a, n, n, a, s, an, nn, na, as, ann, nna, nas, anna, nnas
annex, a, n, n, e, x, an, nn, ne, ex, ann, nne, nex, anne, nnex
annoy, a, n, n, o, y, an, nn, no, oy, ann, nno, noy, anno, nnoy
annul, a, n, n, u, l, an, nn, nu, ul, ann, nnu, nul, annu, nnul
anoas, a, n, o, a, s, an, no, oa, as, ano, noa, oas, anoa, noas
anode, a, n, o, d, e, an, no, od, de, ano, nod, ode, anod, node
anole, a, n, o, l, e, an, no, ol, le, ano, nol, ole, anol, nole
anomy, a, n, o, m, y, an, no, om, my, ano, nom, omy, anom, nomy
ansae, a, n, s, a, e, an, ns, sa, ae, ans, nsa, sae, ansa, nsae
antae, a, n, t, a, e, an, nt, ta, ae, ant, nta, tae, anta, ntae
antas, a, n, t, a, s, an, nt, ta, as, ant, nta, tas, anta, ntas
anted, a, n, t, e, d, an, nt, te, ed, ant, nte, ted, ante, nted
antes, a, n, t, e, s, an, nt, te, es, ant, nte, tes, ante, ntes
antic, a, n, t, i, c, an, nt, ti, ic, ant, nti, tic, anti, ntic
antis, a, n, t, i, s, an, nt, ti, is, ant, nti, tis, anti, ntis
antra, a, n, t, r, a, an, nt, tr, ra, ant, ntr, tra, antr, ntra
antre, a, n, t, r, e, an, nt, tr, re, ant, ntr, tre, antr, ntre
antsy, a, n, t, s, y, an, nt, ts, sy, ant, nts, tsy, ants, ntsy
anvil, a, n, v, i, l, an, nv, vi, il, anv, nvi, vil, anvi, nvil
anyon, a, n, y, o, n, an, ny, yo, on, any, nyo, yon, anyo, nyon
aorta, a, o, r, t, a, ao, or, rt, ta, aor, ort, rta, aort, orta
apace, a, p, a, c, e, ap, pa, ac, ce, apa, pac, ace, apac, pace
apart, a, p, a, r, t, ap, pa, ar, rt, apa, par, art, apar, part
apeak, a, p, e, a, k, ap, pe, ea, ak, ape, pea, eak, apea, peak
apeek, a, p, e, e, k, ap, pe, ee, ek, ape, pee, eek, apee, peek
apers, a, p, e, r, s, ap, pe, er, rs, ape, per, ers, aper, pers
apery, a, p, e, r, y, ap, pe, er, ry, ape, per, ery, aper, pery
aphid, a, p, h, i, d, ap, ph, hi, id, aph, phi, hid, aphi, phid
aphis, a, p, h, i, s, ap, ph, hi, is, aph, phi, his, aphi, phis
apian, a, p, i, a, n, ap, pi, ia, an, api, pia, ian, apia, pian
aping, a, p, i, n, g, ap, pi, in, ng, api, pin, ing, apin, ping
apish, a, p, i, s, h, ap, pi, is, sh, api, pis, ish, apis, pish
apnea, a, p, n, e, a, ap, pn, ne, ea, apn, pne, nea, apne, pnea
apods, a, p, o, d, s, ap, po, od, ds, apo, pod, ods, apod, pods
aport, a, p, o, r, t, ap, po, or, rt, apo, por, ort, apor, port
appal, a, p, p, a, l, ap, pp, pa, al, app, ppa, pal, appa, ppal
appel, a, p, p, e, l, ap, pp, pe, el, app, ppe, pel, appe, ppel
apple, a, p, p, l, e, ap, pp, pl, le, app, ppl, ple, appl, pple
apply, a, p, p, l, y, ap, pp, pl, ly, app, ppl, ply, appl, pply
apres, a, p, r, e, s, ap, pr, re, es, apr, pre, res, apre, pres
apron, a, p, r, o, n, ap, pr, ro, on, apr, pro, ron, apro, pron
apses, a, p, s, e, s, ap, ps, se, es, aps, pse, ses, apse, pses
apsis, a, p, s, i, s, ap, ps, si, is, aps, psi, sis, apsi, psis
apter, a, p, t, e, r, ap, pt, te, er, apt, pte, ter, apte, pter
aptly, a, p, t, l, y, ap, pt, tl, ly, apt, ptl, tly, aptl, ptly
aquae, a, q, u, a, e, aq, qu, ua, ae, aqu, qua, uae, aqua, quae
aquas, a, q, u, a, s, aq, qu, ua, as, aqu, qua, uas, aqua, quas
araks, a, r, a, k, s, ar, ra, ak, ks, ara, rak, aks, arak, raks
arame, a, r, a, m, e, ar, ra, am, me, ara, ram, ame, aram, rame
arbor, a, r, b, o, r, ar, rb, bo, or, arb, rbo, bor, arbo, rbor
arced, a, r, c, e, d, ar, rc, ce, ed, arc, rce, ced, arce, rced
arcus, a, r, c, u, s, ar, rc, cu, us, arc, rcu, cus, arcu, rcus
ardeb, a, r, d, e, b, ar, rd, de, eb, ard, rde, deb, arde, rdeb
ardor, a, r, d, o, r, ar, rd, do, or, ard, rdo, dor, ardo, rdor
areae, a, r, e, a, e, ar, re, ea, ae, are, rea, eae, area, reae
areal, a, r, e, a, l, ar, re, ea, al, are, rea, eal, area, real
areas, a, r, e, a, s, ar, re, ea, as, are, rea, eas, area, reas
areca, a, r, e, c, a, ar, re, ec, ca, are, rec, eca, arec, reca
areic, a, r, e, i, c, ar, re, ei, ic, are, rei, eic, arei, reic
arena, a, r, e, n, a, ar, re, en, na, are, ren, ena, aren, rena
arene, a, r, e, n, e, ar, re, en, ne, are, ren, ene, aren, rene
arepa, a, r, e, p, a, ar, re, ep, pa, are, rep, epa, arep, repa
arete, a, r, e, t, e, ar, re, et, te, are, ret, ete, aret, rete
argal, a, r, g, a, l, ar, rg, ga, al, arg, rga, gal, arga, rgal
argil, a, r, g, i, l, ar, rg, gi, il, arg, rgi, gil, argi, rgil
argle, a, r, g, l, e, ar, rg, gl, le, arg, rgl, gle, argl, rgle
argol, a, r, g, o, l, ar, rg, go, ol, arg, rgo, gol, argo, rgol
argon, a, r, g, o, n, ar, rg, go, on, arg, rgo, gon, argo, rgon
argot, a, r, g, o, t, ar, rg, go, ot, arg, rgo, got, argo, rgot
argue, a, r, g, u, e, ar, rg, gu, ue, arg, rgu, gue, argu, rgue
argus, a, r, g, u, s, ar, rg, gu, us, arg, rgu, gus, argu, rgus
arhat, a, r, h, a, t, ar, rh, ha, at, arh, rha, hat, arha, rhat
arias, a, r, i, a, s, ar, ri, ia, as, ari, ria, ias, aria, rias
ariel, a, r, i, e, l, ar, ri, ie, el, ari, rie, iel, arie, riel
arils, a, r, i, l, s, ar, ri, il, ls, ari, ril, ils, aril, rils
arise, a, r, i, s, e, ar, ri, is, se, ari, ris, ise, aris, rise
arles, a, r, l, e, s, ar, rl, le, es, arl, rle, les, arle, rles
armed, a, r, m, e, d, ar, rm, me, ed, arm, rme, med, arme, rmed
armer, a, r, m, e, r, ar, rm, me, er, arm, rme, mer, arme, rmer
armet, a, r, m, e, t, ar, rm, me, et, arm, rme, met, arme, rmet
armor, a, r, m, o, r, ar, rm, mo, or, arm, rmo, mor, armo, rmor
aroid, a, r, o, i, d, ar, ro, oi, id, aro, roi, oid, aroi, roid
aroma, a, r, o, m, a, ar, ro, om, ma, aro, rom, oma, arom, roma
arose, a, r, o, s, e, ar, ro, os, se, aro, ros, ose, aros, rose
arpen, a, r, p, e, n, ar, rp, pe, en, arp, rpe, pen, arpe, rpen
arras, a, r, r, a, s, ar, rr, ra, as, arr, rra, ras, arra, rras
array, a, r, r, a, y, ar, rr, ra, ay, arr, rra, ray, arra, rray
arris, a, r, r, i, s, ar, rr, ri, is, arr, rri, ris, arri, rris
arrow, a, r, r, o, w, ar, rr, ro, ow, arr, rro, row, arro, rrow
arses, a, r, s, e, s, ar, rs, se, es, ars, rse, ses, arse, rses
arsis, a, r, s, i, s, ar, rs, si, is, ars, rsi, sis, arsi, rsis
arson, a, r, s, o, n, ar, rs, so, on, ars, rso, son, arso, rson
artal, a, r, t, a, l, ar, rt, ta, al, art, rta, tal, arta, rtal
artel, a, r, t, e, l, ar, rt, te, el, art, rte, tel, arte, rtel
artsy, a, r, t, s, y, ar, rt, ts, sy, art, rts, tsy, arts, rtsy
arums, a, r, u, m, s, ar, ru, um, ms, aru, rum, ums, arum, rums
arval, a, r, v, a, l, ar, rv, va, al, arv, rva, val, arva, rval
arvos, a, r, v, o, s, ar, rv, vo, os, arv, rvo, vos, arvo, rvos
aryls, a, r, y, l, s, ar, ry, yl, ls, ary, ryl, yls, aryl, ryls
asana, a, s, a, n, a, as, sa, an, na, asa, san, ana, asan, sana
