estop, e, s, t, o, p, es, st, to, op, est, sto, top, esto, stop
etape, e, t, a, p, e, et, ta, ap, pe, eta, tap, ape, etap, tape
ether, e, t, h, e, r, et, th, he, er, eth, the, her, ethe, ther
ethic, e, t, h, i, c, et, th, hi, ic, eth, thi, hic, ethi, thic
ethos, e, t, h, o, s, et, th, ho, os, eth, tho, hos, etho, thos
ethyl, e, t, h, y, l, et, th, hy, yl, eth, thy, hyl, ethy, thyl
etnas, e, t, n, a, s, et, tn, na, as, etn, tna, nas, etna, tnas
etude, e, t, u, d, e, et, tu, ud, de, etu, tud, ude, etud, tude
etuis, e, t, u, i, s, et, tu, ui, is, etu, tui, uis, etui, tuis
etwee, e, t, w, e, e, et, tw, we, ee, etw, twe, wee, etwe, twee
etyma, e, t, y, m, a, et, ty, ym, ma, ety, tym, yma, etym, tyma
euros, e, u, r, o, s, eu, ur, ro, os, eur, uro, ros, euro, uros
evade, e, v, a, d, e, ev, va, ad, de, eva, vad, ade, evad, vade
evens, e, v, e, n, s, ev, ve, en, ns, eve, ven, ens, even, vens
event, e, v, e, n, t, ev, ve, en, nt, eve, ven, ent, even, vent
evert, e, v, e, r, t, ev, ve, er, rt, eve, ver, ert, ever, vert
every, e, v, e, r, y, ev, ve, er, ry, eve, ver, ery, ever, very
evict, e, v, i, c, t, ev, vi, ic, ct, evi, vic, ict, evic, vict
evils, e, v, i, l, s, ev, vi, il, ls, evi, vil, ils, evil, vils
evite, e, v, i, t, e, ev, vi, it, te, evi, vit, ite, evit, vite
evoke, e, v, o, k, e, ev, vo, ok, ke, evo, vok, oke, evok, voke
ewers, e, w, e, r, s, ew, we, er, rs, ewe, wer, ers, ewer, wers
exact, e, x, a, c, t, ex, xa, ac, ct, exa, xac, act, exac, xact
exalt, e, x, a, l, t, ex, xa, al, lt, exa, xal, alt, exal, xalt
exams, e, x, a, m, s, ex, xa, am, ms, exa, xam, ams, exam, xams
excel, e, x, c, e, l, ex, xc, ce, el, exc, xce, cel, exce, xcel
execs, e, x, e, c, s, ex, xe, ec, cs, exe, xec, ecs, exec, xecs
exert, e, x, e, r, t, ex, xe, er, rt, exe, xer, ert, exer, xert
exile, e, x, i, l, e, ex, xi, il, le, exi, xil, ile, exil, xile
exine, e, x, i, n, e, ex, xi, in, ne, exi, xin, ine, exin, xine
exing, e, x, i, n, g, ex, xi, in, ng, exi, xin, ing, exin, xing
exist, e, x, i, s, t, ex, xi, is, st, exi, xis, ist, exis, xist
exits, e, x, i, t, s, ex, xi, it, ts, exi, xit, its, exit, xits
exons, e, x, o, n, s, ex, xo, on, ns, exo, xon, ons, exon, xons
expat, e, x, p, a, t, ex, xp, pa, at, exp, xpa, pat, expa, xpat
expel, e, x, p, e, l, ex, xp, pe, el, exp, xpe, pel, expe, xpel
expos, e, x, p, o, s, ex, xp, po, os, exp, xpo, pos, expo, xpos
extol, e, x, t, o, l, ex, xt, to, ol, ext, xto, tol, exto, xtol
extra, e, x, t, r, a, ex, xt, tr, ra, ext, xtr, tra, extr, xtra
exude, e, x, u, d, e, ex, xu, ud, de, exu, xud, ude, exud, xude
exult, e, x, u, l, t, ex, xu, ul, lt, exu, xul, ult, exul, xult
exurb, e, x, u, r, b, ex, xu, ur, rb, exu, xur, urb, exur, xurb
eyass, e, y, a, s, s, ey, ya, as, ss, eya, yas, ass, eyas, yass
eyers, e, y, e, r, s, ey, ye, er, rs, eye, yer, ers, eyer, yers
eying, e, y, i, n, g, ey, yi, in, ng, eyi, yin, ing, eyin, ying
eyras, e, y, r, a, s, ey, yr, ra, as, eyr, yra, ras, eyra, yras
eyres, e, y, r, e, s, ey, yr, re, es, eyr, yre, res, eyre, yres
eyrie, e, y, r, i, e, ey, yr, ri, ie, eyr, yri, rie, eyri, yrie
eyrir, e, y, r, i, r, ey, yr, ri, ir, eyr, yri, rir, eyri, yrir
fable, f, a, b, l, e, fa, ab, bl, le, fab, abl, ble, fabl, able
faced, f, a, c, e, d, fa, ac, ce, ed, fac, ace, ced, face, aced
facer, f, a, c, e, r, fa, ac, ce, er, fac, ace, cer, face, acer
faces, f, a, c, e, s, fa, ac, ce, es, fac, ace, ces, face, aces
facet, f, a, c, e, t, fa, ac, ce, et, fac, ace, cet, face, acet
facia, f, a, c, i, a, fa, ac, ci, ia, fac, aci, cia, faci, acia
facts, f, a, c, t, s, fa, ac, ct, ts, fac, act, cts, fact, acts
faddy, f, a, d, d, y, fa, ad, dd, dy, fad, add, ddy, fadd, addy
faded, f, a, d, e, d, fa, ad, de, ed, fad, ade, ded, fade, aded
fader, f, a, d, e, r, fa, ad, de, er, fad, ade, der, fade, ader
fades, f, a, d, e, s, fa, ad, de, es, fad, ade, des, fade, ades
fadge, f, a, d, g, e, fa, ad, dg, ge, fad, adg, dge, fadg, adge
fados, f, a, d, o, s, fa, ad, do, os, fad, ado, dos, fado, ados
faena, f, a, e, n, a, fa, ae, en, na, fae, aen, ena, faen, aena
faery, f, a, e, r, y, fa, ae, er, ry, fae, aer, ery, faer, aery
faggy, f, a, g, g, y, fa, ag, gg, gy, fag, agg, ggy, fagg, aggy
fagin, f, a, g, i, n, fa, ag, gi, in, fag, agi, gin, fagi, agin
fagot, f, a, g, o, t, fa, ag, go, ot, fag, ago, got, fago, agot
fails, f, a, i, l, s, fa, ai, il, ls, fai, ail, ils, fail, ails
faint, f, a, i, n, t, fa, ai, in, nt, fai, ain, int, fain, aint
fairs, f, a, i, r, s, fa, ai, ir, rs, fai, air, irs, fair, airs
fairy, f, a, i, r, y, fa, ai, ir, ry, fai, air, iry, fair, airy
faith, f, a, i, t, h, fa, ai, it, th, fai, ait, ith, fait, aith
faked, f, a, k, e, d, fa, ak, ke, ed, fak, ake, ked, fake, aked
faker, f, a, k, e, r, fa, ak, ke, er, fak, ake, ker, fake, aker
fakes, f, a, k, e, s, fa, ak, ke, es, fak, ake, kes, fake, akes
fakey, f, a, k, e, y, fa, ak, ke, ey, fak, ake, key, fake, akey
fakir, f, a, k, i, r, fa, ak, ki, ir, fak, aki, kir, faki, akir
falls, f, a, l, l, s, fa, al, ll, ls, fal, all, lls, fall, alls
false, f, a, l, s, e, fa, al, ls, se, fal, als, lse, fals, alse
famed, f, a, m, e, d, fa, am, me, ed, fam, ame, med, fame, amed
fames, f, a, m, e, s, fa, am, me, es, fam, ame, mes, fame, ames
fancy, f, a, n, c, y, fa, an, nc, cy, fan, anc, ncy, fanc, ancy
fanes, f, a, n, e, s, fa, an, ne, es, fan, ane, nes, fane, anes
fanga, f, a, n, g, a, fa, an, ng, ga, fan, ang, nga, fang, anga
fangs, f, a, n, g, s, fa, an, ng, gs, fan, ang, ngs, fang, angs
fanny, f, a, n, n, y, fa, an, nn, ny, fan, ann, nny, fann, anny
fanon, f, a, n, o, n, fa, an, no, on, fan, ano, non, fano, anon
fanos, f, a, n, o, s, fa, an, no, os, fan, ano, nos, fano, anos
fanum, f, a, n, u, m, fa, an, nu, um, fan, anu, num, fanu, anum
faqir, f, a, q, i, r, fa, aq, qi, ir, faq, aqi, qir, faqi, aqir
farad, f, a, r, a, d, fa, ar, ra, ad, far, ara, rad, fara, arad
farce, f, a, r, c, e, fa, ar, rc, ce, far, arc, rce, farc, arce
farci, f, a, r, c, i, fa, ar, rc, ci, far, arc, rci, farc, arci
farcy, f, a, r, c, y, fa, ar, rc, cy, far, arc, rcy, farc, arcy
fards, f, a, r, d, s, fa, ar, rd, ds, far, ard, rds, fard, ards
fared, f, a, r, e, d, fa, ar, re, ed, far, are, red, fare, ared
farer, f, a, r, e, r, fa, ar, re, er, far, are, rer, fare, arer
fares, f, a, r, e, s, fa, ar, re, es, far, are, res, fare, ares
farle, f, a, r, l, e, fa, ar, rl, le, far, arl, rle, farl, arle
farls, f, a, r, l, s, fa, ar, rl, ls, far, arl, rls, farl, arls
farms, f, a, r, m, s, fa, ar, rm, ms, far, arm, rms, farm, arms
faros, f, a, r, o, s, fa, ar, ro, os, far, aro, ros, faro, aros
farts, f, a, r, t, s, fa, ar, rt, ts, far, art, rts, fart, arts
fasts, f, a, s, t, s, fa, as, st, ts, fas, ast, sts, fast, asts
fatal, f, a, t, a, l, fa, at, ta, al, fat, ata, tal, fata, atal
fated, f, a, t, e, d, fa, at, te, ed, fat, ate, ted, fate, ated
fates, f, a, t, e, s, fa, at, te, es, fat, ate, tes, fate, ates
fatly, f, a, t, l, y, fa, at, tl, ly, fat, atl, tly, fatl, atly
fatso, f, a, t, s, o, fa, at, ts, so, fat, ats, tso, fats, atso
fatty, f, a, t, t, y, fa, at, tt, ty, fat, att, tty, fatt, atty
fatwa, f, a, t, w, a, fa, at, tw, wa, fat, atw, twa, fatw, atwa
faugh, f, a, u, g, h, fa, au, ug, gh, fau, aug, ugh, faug, augh
fauld, f, a, u, l, d, fa, au, ul, ld, fau, aul, uld, faul, auld
fault, f, a, u, l, t, fa, au, ul, lt, fau, aul, ult, faul, ault
fauna, f, a, u, n, a, fa, au, un, na, fau, aun, una, faun, auna
fauns, f, a, u, n, s, fa, au, un, ns, fau, aun, uns, faun, auns
fauve, f, a, u, v, e, fa, au, uv, ve, fau, auv, uve, fauv, auve
favas, f, a, v, a, s, fa, av, va, as, fav, ava, vas, fava, avas
faves, f, a, v, e, s, fa, av, ve, es, fav, ave, ves, fave, aves
favor, f, a, v, o, r, fa, av, vo, or, fav, avo, vor, favo, avor
favus, f, a, v, u, s, fa, av, vu, us, fav, avu, vus, favu, avus
fawns, f, a, w, n, s, fa, aw, wn, ns, faw, awn, wns, fawn, awns
fawny, f, a, w, n, y, fa, aw, wn, ny, faw, awn, wny, fawn, awny
faxed, f, a, x, e, d, fa, ax, xe, ed, fax, axe, xed, faxe, axed
faxes, f, a, x, e, s, fa, ax, xe, es, fax, axe, xes, faxe, axes
fayed, f, a, y, e, d, fa, ay, ye, ed, fay, aye, yed, faye, ayed
fazed, f, a, z, e, d, fa, az, ze, ed, faz, aze, zed, faze, azed
fazes, f, a, z, e, s, fa, az, ze, es, faz, aze, zes, faze, azes
fears, f, e, a, r, s, fe, ea, ar, rs, fea, ear, ars, fear, ears
fease, f, e, a, s, e, fe, ea, as, se, fea, eas, ase, feas, ease
feast, f, e, a, s, t, fe, ea, as, st, fea, eas, ast, feas, east
feats, f, e, a, t, s, fe, ea, at, ts, fea, eat, ats, feat, eats
feaze, f, e, a, z, e, fe, ea, az, ze, fea, eaz, aze, feaz, eaze
fecal, f, e, c, a, l, fe, ec, ca, al, fec, eca, cal, feca, ecal
feces, f, e, c, e, s, fe, ec, ce, es, fec, ece, ces, fece, eces
fecks, f, e, c, k, s, fe, ec, ck, ks, fec, eck, cks, feck, ecks
fedex, f, e, d, e, x, fe, ed, de, ex, fed, ede, dex, fede, edex
feebs, f, e, e, b, s, fe, ee, eb, bs, fee, eeb, ebs, feeb, eebs
feeds, f, e, e, d, s, fe, ee, ed, ds, fee, eed, eds, feed, eeds
feels, f, e, e, l, s, fe, ee, el, ls, fee, eel, els, feel, eels
feeze, f, e, e, z, e, fe, ee, ez, ze, fee, eez, eze, feez, eeze
feign, f, e, i, g, n, fe, ei, ig, gn, fei, eig, ign, feig, eign
feint, f, e, i, n, t, fe, ei, in, nt, fei, ein, int, fein, eint
feist, f, e, i, s, t, fe, ei, is, st, fei, eis, ist, feis, eist
felid, f, e, l, i, d, fe, el, li, id, fel, eli, lid, feli, elid
fella, f, e, l, l, a, fe, el, ll, la, fel, ell, lla, fell, ella
fells, f, e, l, l, s, fe, el, ll, ls, fel, ell, lls, fell, ells
felly, f, e, l, l, y, fe, el, ll, ly, fel, ell, lly, fell, elly
felon, f, e, l, o, n, fe, el, lo, on, fel, elo, lon, felo, elon
felts, f, e, l, t, s, fe, el, lt, ts, fel, elt, lts, felt, elts
femes, f, e, m, e, s, fe, em, me, es, fem, eme, mes, feme, emes
femme, f, e, m, m, e, fe, em, mm, me, fem, emm, mme, femm, emme
femur, f, e, m, u, r, fe, em, mu, ur, fem, emu, mur, femu, emur
fence, f, e, n, c, e, fe, en, nc, ce, fen, enc, nce, fenc, ence
fends, f, e, n, d, s, fe, en, nd, ds, fen, end, nds, fend, ends
fenny, f, e, n, n, y, fe, en, nn, ny, fen, enn, nny, fenn, enny
feods, f, e, o, d, s, fe, eo, od, ds, feo, eod, ods, feod, eods
feoff, f, e, o, f, f, fe, eo, of, ff, feo, eof, off, feof, eoff
feral, f, e, r, a, l, fe, er, ra, al, fer, era, ral, fera, eral
feres, f, e, r, e, s, fe, er, re, es, fer, ere, res, fere, eres
feria, f, e, r, i, a, fe, er, ri, ia, fer, eri, ria, feri, eria
ferly, f, e, r, l, y, fe, er, rl, ly, fer, erl, rly, ferl, erly
fermi, f, e, r, m, i, fe, er, rm, mi, fer, erm, rmi, ferm, ermi
ferns, f, e, r, n, s, fe, er, rn, ns, fer, ern, rns, fern, erns
ferny, f, e, r, n, y, fe, er, rn, ny, fer, ern, rny, fern, erny
ferry, f, e, r, r, y, fe, er, rr, ry, fer, err, rry, ferr, erry
fesse, f, e, s, s, e, fe, es, ss, se, fes, ess, sse, fess, esse
fests, f, e, s, t, s, fe, es, st, ts, fes, est, sts, fest, ests
fetal, f, e, t, a, l, fe, et, ta, al, fet, eta, tal, feta, etal
fetas, f, e, t, a, s, fe, et, ta, as, fet, eta, tas, feta, etas
fetch, f, e, t, c, h, fe, et, tc, ch, fet, etc, tch, fetc, etch
feted, f, e, t, e, d, fe, et, te, ed, fet, ete, ted, fete, eted
fetes, f, e, t, e, s, fe, et, te, es, fet, ete, tes, fete, etes
fetid, f, e, t, i, d, fe, et, ti, id, fet, eti, tid, feti, etid
fetor, f, e, t, o, r, fe, et, to, or, fet, eto, tor, feto, etor
fetus, f, e, t, u, s, fe, et, tu, us, fet, etu, tus, fetu, etus
feuar, f, e, u, a, r, fe, eu, ua, ar, feu, eua, uar, feua, euar
feuds, f, e, u, d, s, fe, eu, ud, ds, feu, eud, uds, feud, euds
feued, f, e, u, e, d, fe, eu, ue, ed, feu, eue, ued, feue, eued
fever, f, e, v, e, r, fe, ev, ve, er, fev, eve, ver, feve, ever
fewer, f, e, w, e, r, fe, ew, we, er, few, ewe, wer, fewe, ewer
feyer, f, e, y, e, r, fe, ey, ye, er, fey, eye, yer, feye, eyer
feyly, f, e, y, l, y, fe, ey, yl, ly, fey, eyl, yly, feyl, eyly
fezes, f, e, z, e, s, fe, ez, ze, es, fez, eze, zes, feze, ezes
fezzy, f, e, z, z, y, fe, ez, zz, zy, fez, ezz, zzy, fezz, ezzy
fiars, f, i, a, r, s, fi, ia, ar, rs, fia, iar, ars, fiar, iars
fiats, f, i, a, t, s, fi, ia, at, ts, fia, iat, ats, fiat, iats
fiber, f, i, b, e, r, fi, ib, be, er, fib, ibe, ber, fibe, iber
fibre, f, i, b, r, e, fi, ib, br, re, fib, ibr, bre, fibr, ibre
fices, f, i, c, e, s, fi, ic, ce, es, fic, ice, ces, fice, ices
fiche, f, i, c, h, e, fi, ic, ch, he, fic, ich, che, fich, iche
fichu, f, i, c, h, u, fi, ic, ch, hu, fic, ich, chu, fich, ichu
ficin, f, i, c, i, n, fi, ic, ci, in, fic, ici, cin, fici, icin
ficus, f, i, c, u, s, fi, ic, cu, us, fic, icu, cus, ficu, icus
fidge, f, i, d, g, e, fi, id, dg, ge, fid, idg, dge, fidg, idge
fidos, f, i, d, o, s, fi, id, do, os, fid, ido, dos, fido, idos
fiefs, f, i, e, f, s, fi, ie, ef, fs, fie, ief, efs, fief, iefs
field, f, i, e, l, d, fi, ie, el, ld, fie, iel, eld, fiel, ield
fiend, f, i, e, n, d, fi, ie, en, nd, fie, ien, end, fien, iend
fiery, f, i, e, r, y, fi, ie, er, ry, fie, ier, ery, fier, iery
fifed, f, i, f, e, d, fi, if, fe, ed, fif, ife, fed, fife, ifed
fifer, f, i, f, e, r, fi, if, fe, er, fif, ife, fer, fife, ifer
fifes, f, i, f, e, s, fi, if, fe, es, fif, ife, fes, fife, ifes
fifth, f, i, f, t, h, fi, if, ft, th, fif, ift, fth, fift, ifth
fifty, f, i, f, t, y, fi, if, ft, ty, fif, ift, fty, fift, ifty
fight, f, i, g, h, t, fi, ig, gh, ht, fig, igh, ght, figh, ight
filar, f, i, l, a, r, fi, il, la, ar, fil, ila, lar, fila, ilar
filch, f, i, l, c, h, fi, il, lc, ch, fil, ilc, lch, filc, ilch
filed, f, i, l, e, d, fi, il, le, ed, fil, ile, led, file, iled
filer, f, i, l, e, r, fi, il, le, er, fil, ile, ler, file, iler
files, f, i, l, e, s, fi, il, le, es, fil, ile, les, file, iles
filet, f, i, l, e, t, fi, il, le, et, fil, ile, let, file, ilet
fille, f, i, l, l, e, fi, il, ll, le, fil, ill, lle, fill, ille
fillo, f, i, l, l, o, fi, il, ll, lo, fil, ill, llo, fill, illo
fills, f, i, l, l, s, fi, il, ll, ls, fil, ill, lls, fill, ills
filly, f, i, l, l, y, fi, il, ll, ly, fil, ill, lly, fill, illy
filmi, f, i, l, m, i, fi, il, lm, mi, fil, ilm, lmi, film, ilmi
films, f, i, l, m, s, fi, il, lm, ms, fil, ilm, lms, film, ilms
filmy, f, i, l, m, y, fi, il, lm, my, fil, ilm, lmy, film, ilmy
filos, f, i, l, o, s, fi, il, lo, os, fil, ilo, los, filo, ilos
filth, f, i, l, t, h, fi, il, lt, th, fil, ilt, lth, filt, ilth
filum, f, i, l, u, m, fi, il, lu, um, fil, ilu, lum, filu, ilum
final, f, i, n, a, l, fi, in, na, al, fin, ina, nal, fina, inal
finca, f, i, n, c, a, fi, in, nc, ca, fin, inc, nca, finc, inca
finch, f, i, n, c, h, fi, in, nc, ch, fin, inc, nch, finc, inch
finds, f, i, n, d, s, fi, in, nd, ds, fin, ind, nds, find, inds
fined, f, i, n, e, d, fi, in, ne, ed, fin, ine, ned, fine, ined
finer, f, i, n, e, r, fi, in, ne, er, fin, ine, ner, fine, iner
fines, f, i, n, e, s, fi, in, ne, es, fin, ine, nes, fine, ines
finis, f, i, n, i, s, fi, in, ni, is, fin, ini, nis, fini, inis
finks, f, i, n, k, s, fi, in, nk, ks, fin, ink, nks, fink, inks
finny, f, i, n, n, y, fi, in, nn, ny, fin, inn, nny, finn, inny
finos, f, i, n, o, s, fi, in, no, os, fin, ino, nos, fino, inos
fiord, f, i, o, r, d, fi, io, or, rd, fio, ior, ord, fior, iord
fique, f, i, q, u, e, fi, iq, qu, ue, fiq, iqu, que, fiqu, ique
fired, f, i, r, e, d, fi, ir, re, ed, fir, ire, red, fire, ired
firer, f, i, r, e, r, fi, ir, re, er, fir, ire, rer, fire, irer
fires, f, i, r, e, s, fi, ir, re, es, fir, ire, res, fire, ires
firms, f, i, r, m, s, fi, ir, rm, ms, fir, irm, rms, firm, irms
firns, f, i, r, n, s, fi, ir, rn, ns, fir, irn, rns, firn, irns
firry, f, i, r, r, y, fi, ir, rr, ry, fir, irr, rry, firr, irry
first, f, i, r, s, t, fi, ir, rs, st, fir, irs, rst, firs, irst
firth, f, i, r, t, h, fi, ir, rt, th, fir, irt, rth, firt, irth
fiscs, f, i, s, c, s, fi, is, sc, cs, fis, isc, scs, fisc, iscs
fishy, f, i, s, h, y, fi, is, sh, hy, fis, ish, shy, fish, ishy
fists, f, i, s, t, s, fi, is, st, ts, fis, ist, sts, fist, ists
fitch, f, i, t, c, h, fi, it, tc, ch, fit, itc, tch, fitc, itch
fitly, f, i, t, l, y, fi, it, tl, ly, fit, itl, tly, fitl, itly
fiver, f, i, v, e, r, fi, iv, ve, er, fiv, ive, ver, five, iver
fives, f, i, v, e, s, fi, iv, ve, es, fiv, ive, ves, five, ives
fixed, f, i, x, e, d, fi, ix, xe, ed, fix, ixe, xed, fixe, ixed
fixer, f, i, x, e, r, fi, ix, xe, er, fix, ixe, xer, fixe, ixer
fixes, f, i, x, e, s, fi, ix, xe, es, fix, ixe, xes, fixe, ixes
fixit, f, i, x, i, t, fi, ix, xi, it, fix, ixi, xit, fixi, ixit
fizzy, f, i, z, z, y, fi, iz, zz, zy, fiz, izz, zzy, fizz, izzy
fjeld, f, j, e, l, d, fj, je, el, ld, fje, jel, eld, fjel, jeld
fjord, f, j, o, r, d, fj, jo, or, rd, fjo, jor, ord, fjor, jord
flabs, f, l, a, b, s, fl, la, ab, bs, fla, lab, abs, flab, labs
flack, f, l, a, c, k, fl, la, ac, ck, fla, lac, ack, flac, lack
flags, f, l, a, g, s, fl, la, ag, gs, fla, lag, ags, flag, lags
flail, f, l, a, i, l, fl, la, ai, il, fla, lai, ail, flai, lail
flair, f, l, a, i, r, fl, la, ai, ir, fla, lai, air, flai, lair
flake, f, l, a, k, e, fl, la, ak, ke, fla, lak, ake, flak, lake
flaky, f, l, a, k, y, fl, la, ak, ky, fla, lak, aky, flak, laky
flame, f, l, a, m, e, fl, la, am, me, fla, lam, ame, flam, lame
flams, f, l, a, m, s, fl, la, am, ms, fla, lam, ams, flam, lams
flamy, f, l, a, m, y, fl, la, am, my, fla, lam, amy, flam, lamy
flank, f, l, a, n, k, fl, la, an, nk, fla, lan, ank, flan, lank
flans, f, l, a, n, s, fl, la, an, ns, fla, lan, ans, flan, lans
flaps, f, l, a, p, s, fl, la, ap, ps, fla, lap, aps, flap, laps
flare, f, l, a, r, e, fl, la, ar, re, fla, lar, are, flar, lare
flash, f, l, a, s, h, fl, la, as, sh, fla, las, ash, flas, lash
flask, f, l, a, s, k, fl, la, as, sk, fla, las, ask, flas, lask
flats, f, l, a, t, s, fl, la, at, ts, fla, lat, ats, flat, lats
flaws, f, l, a, w, s, fl, la, aw, ws, fla, law, aws, flaw, laws
flawy, f, l, a, w, y, fl, la, aw, wy, fla, law, awy, flaw, lawy
flaxy, f, l, a, x, y, fl, la, ax, xy, fla, lax, axy, flax, laxy
flays, f, l, a, y, s, fl, la, ay, ys, fla, lay, ays, flay, lays
fleam, f, l, e, a, m, fl, le, ea, am, fle, lea, eam, flea, leam
fleas, f, l, e, a, s, fl, le, ea, as, fle, lea, eas, flea, leas
fleck, f, l, e, c, k, fl, le, ec, ck, fle, lec, eck, flec, leck
fleer, f, l, e, e, r, fl, le, ee, er, fle, lee, eer, flee, leer
flees, f, l, e, e, s, fl, le, ee, es, fle, lee, ees, flee, lees
fleet, f, l, e, e, t, fl, le, ee, et, fle, lee, eet, flee, leet
flesh, f, l, e, s, h, fl, le, es, sh, fle, les, esh, fles, lesh
flews, f, l, e, w, s, fl, le, ew, ws, fle, lew, ews, flew, lews
fleys, f, l, e, y, s, fl, le, ey, ys, fle, ley, eys, fley, leys
flick, f, l, i, c, k, fl, li, ic, ck, fli, lic, ick, flic, lick
flics, f, l, i, c, s, fl, li, ic, cs, fli, lic, ics, flic, lics
flied, f, l, i, e, d, fl, li, ie, ed, fli, lie, ied, flie, lied
flier, f, l, i, e, r, fl, li, ie, er, fli, lie, ier, flie, lier
flies, f, l, i, e, s, fl, li, ie, es, fli, lie, ies, flie, lies
fling, f, l, i, n, g, fl, li, in, ng, fli, lin, ing, flin, ling
flint, f, l, i, n, t, fl, li, in, nt, fli, lin, int, flin, lint
flips, f, l, i, p, s, fl, li, ip, ps, fli, lip, ips, flip, lips
flirs, f, l, i, r, s, fl, li, ir, rs, fli, lir, irs, flir, lirs
flirt, f, l, i, r, t, fl, li, ir, rt, fli, lir, irt, flir, lirt
flite, f, l, i, t, e, fl, li, it, te, fli, lit, ite, flit, lite
flits, f, l, i, t, s, fl, li, it, ts, fli, lit, its, flit, lits
float, f, l, o, a, t, fl, lo, oa, at, flo, loa, oat, floa, loat
flock, f, l, o, c, k, fl, lo, oc, ck, flo, loc, ock, floc, lock
flocs, f, l, o, c, s, fl, lo, oc, cs, flo, loc, ocs, floc, locs
floes, f, l, o, e, s, fl, lo, oe, es, flo, loe, oes, floe, loes
flogs, f, l, o, g, s, fl, lo, og, gs, flo, log, ogs, flog, logs
flong, f, l, o, n, g, fl, lo, on, ng, flo, lon, ong, flon, long
flood, f, l, o, o, d, fl, lo, oo, od, flo, loo, ood, floo, lood
floor, f, l, o, o, r, fl, lo, oo, or, flo, loo, oor, floo, loor
flops, f, l, o, p, s, fl, lo, op, ps, flo, lop, ops, flop, lops
flora, f, l, o, r, a, fl, lo, or, ra, flo, lor, ora, flor, lora
floss, f, l, o, s, s, fl, lo, os, ss, flo, los, oss, flos, loss
flota, f, l, o, t, a, fl, lo, ot, ta, flo, lot, ota, flot, lota
flour, f, l, o, u, r, fl, lo, ou, ur, flo, lou, our, flou, lour
flout, f, l, o, u, t, fl, lo, ou, ut, flo, lou, out, flou, lout
flown, f, l, o, w, n, fl, lo, ow, wn, flo, low, own, flow, lown
flows, f, l, o, w, s, fl, lo, ow, ws, flo, low, ows, flow, lows
flubs, f, l, u, b, s, fl, lu, ub, bs, flu, lub, ubs, flub, lubs
flued, f, l, u, e, d, fl, lu, ue, ed, flu, lue, ued, flue, lued
flues, f, l, u, e, s, fl, lu, ue, es, flu, lue, ues, flue, lues
fluff, f, l, u, f, f, fl, lu, uf, ff, flu, luf, uff, fluf, luff
fluid, f, l, u, i, d, fl, lu, ui, id, flu, lui, uid, flui, luid
fluke, f, l, u, k, e, fl, lu, uk, ke, flu, luk, uke, fluk, luke
fluky, f, l, u, k, y, fl, lu, uk, ky, flu, luk, uky, fluk, luky
flume, f, l, u, m, e, fl, lu, um, me, flu, lum, ume, flum, lume
flump, f, l, u, m, p, fl, lu, um, mp, flu, lum, ump, flum, lump
flung, f, l, u, n, g, fl, lu, un, ng, flu, lun, ung, flun, lung
flunk, f, l, u, n, k, fl, lu, un, nk, flu, lun, unk, flun, lunk
fluor, f, l, u, o, r, fl, lu, uo, or, flu, luo, uor, fluo, luor
flush, f, l, u, s, h, fl, lu, us, sh, flu, lus, ush, flus, lush
flute, f, l, u, t, e, fl, lu, ut, te, flu, lut, ute, flut, lute
fluty, f, l, u, t, y, fl, lu, ut, ty, flu, lut, uty, flut, luty
fluyt, f, l, u, y, t, fl, lu, uy, yt, flu, luy, uyt, fluy, luyt
flyby, f, l, y, b, y, fl, ly, yb, by, fly, lyb, yby, flyb, lyby
flyer, f, l, y, e, r, fl, ly, ye, er, fly, lye, yer, flye, lyer
flyte, f, l, y, t, e, fl, ly, yt, te, fly, lyt, yte, flyt, lyte
foals, f, o, a, l, s, fo, oa, al, ls, foa, oal, als, foal, oals
foams, f, o, a, m, s, fo, oa, am, ms, foa, oam, ams, foam, oams
foamy, f, o, a, m, y, fo, oa, am, my, foa, oam, amy, foam, oamy
focal, f, o, c, a, l, fo, oc, ca, al, foc, oca, cal, foca, ocal
focus, f, o, c, u, s, fo, oc, cu, us, foc, ocu, cus, focu, ocus
foehn, f, o, e, h, n, fo, oe, eh, hn, foe, oeh, ehn, foeh, oehn
fogey, f, o, g, e, y, fo, og, ge, ey, fog, oge, gey, foge, ogey
foggy, f, o, g, g, y, fo, og, gg, gy, fog, ogg, ggy, fogg, oggy
fogie, f, o, g, i, e, fo, og, gi, ie, fog, ogi, gie, fogi, ogie
fohns, f, o, h, n, s, fo, oh, hn, ns, foh, ohn, hns, fohn, ohns
foils, f, o, i, l, s, fo, oi, il, ls, foi, oil, ils, foil, oils
foins, f, o, i, n, s, fo, oi, in, ns, foi, oin, ins, foin, oins
foist, f, o, i, s, t, fo, oi, is, st, foi, ois, ist, fois, oist
folds, f, o, l, d, s, fo, ol, ld, ds, fol, old, lds, fold, olds
foley, f, o, l, e, y, fo, ol, le, ey, fol, ole, ley, fole, oley
folia, f, o, l, i, a, fo, ol, li, ia, fol, oli, lia, foli, olia
folic, f, o, l, i, c, fo, ol, li, ic, fol, oli, lic, foli, olic
folio, f, o, l, i, o, fo, ol, li, io, fol, oli, lio, foli, olio
folks, f, o, l, k, s, fo, ol, lk, ks, fol, olk, lks, folk, olks
folky, f, o, l, k, y, fo, ol, lk, ky, fol, olk, lky, folk, olky
folly, f, o, l, l, y, fo, ol, ll, ly, fol, oll, lly, foll, olly
fonds, f, o, n, d, s, fo, on, nd, ds, fon, ond, nds, fond, onds
fondu, f, o, n, d, u, fo, on, nd, du, fon, ond, ndu, fond, ondu
fonts, f, o, n, t, s, fo, on, nt, ts, fon, ont, nts, font, onts
foods, f, o, o, d, s, fo, oo, od, ds, foo, ood, ods, food, oods
fools, f, o, o, l, s, fo, oo, ol, ls, foo, ool, ols, fool, ools
foots, f, o, o, t, s, fo, oo, ot, ts, foo, oot, ots, foot, oots
footy, f, o, o, t, y, fo, oo, ot, ty, foo, oot, oty, foot, ooty
foram, f, o, r, a, m, fo, or, ra, am, for, ora, ram, fora, oram
foray, f, o, r, a, y, fo, or, ra, ay, for, ora, ray, fora, oray
forbs, f, o, r, b, s, fo, or, rb, bs, for, orb, rbs, forb, orbs
forby, f, o, r, b, y, fo, or, rb, by, for, orb, rby, forb, orby
force, f, o, r, c, e, fo, or, rc, ce, for, orc, rce, forc, orce
fordo, f, o, r, d, o, fo, or, rd, do, for, ord, rdo, ford, ordo
fords, f, o, r, d, s, fo, or, rd, ds, for, ord, rds, ford, ords
fores, f, o, r, e, s, fo, or, re, es, for, ore, res, fore, ores
forge, f, o, r, g, e, fo, or, rg, ge, for, org, rge, forg, orge
forgo, f, o, r, g, o, fo, or, rg, go, for, org, rgo, forg, orgo
forks, f, o, r, k, s, fo, or, rk, ks, for, ork, rks, fork, orks
forky, f, o, r, k, y, fo, or, rk, ky, for, ork, rky, fork, orky
forme, f, o, r, m, e, fo, or, rm, me, for, orm, rme, form, orme
forms, f, o, r, m, s, fo, or, rm, ms, for, orm, rms, form, orms
forte, f, o, r, t, e, fo, or, rt, te, for, ort, rte, fort, orte
forth, f, o, r, t, h, fo, or, rt, th, for, ort, rth, fort, orth
forts, f, o, r, t, s, fo, or, rt, ts, for, ort, rts, fort, orts
forty, f, o, r, t, y, fo, or, rt, ty, for, ort, rty, fort, orty
forum, f, o, r, u, m, fo, or, ru, um, for, oru, rum, foru, orum
fossa, f, o, s, s, a, fo, os, ss, sa, fos, oss, ssa, foss, ossa
fosse, f, o, s, s, e, fo, os, ss, se, fos, oss, sse, foss, osse
fouls, f, o, u, l, s, fo, ou, ul, ls, fou, oul, uls, foul, ouls
found, f, o, u, n, d, fo, ou, un, nd, fou, oun, und, foun, ound
fount, f, o, u, n, t, fo, ou, un, nt, fou, oun, unt, foun, ount
fours, f, o, u, r, s, fo, ou, ur, rs, fou, our, urs, four, ours
fovea, f, o, v, e, a, fo, ov, ve, ea, fov, ove, vea, fove, ovea
fowls, f, o, w, l, s, fo, ow, wl, ls, fow, owl, wls, fowl, owls
foxed, f, o, x, e, d, fo, ox, xe, ed, fox, oxe, xed, foxe, oxed
foxes, f, o, x, e, s, fo, ox, xe, es, fox, oxe, xes, foxe, oxes
foyer, f, o, y, e, r, fo, oy, ye, er, foy, oye, yer, foye, oyer
frags, f, r, a, g, s, fr, ra, ag, gs, fra, rag, ags, frag, rags
frail, f, r, a, i, l, fr, ra, ai, il, fra, rai, ail, frai, rail
frame, f, r, a, m, e, fr, ra, am, me, fra, ram, ame, fram, rame
franc, f, r, a, n, c, fr, ra, an, nc, fra, ran, anc, fran, ranc
frank, f, r, a, n, k, fr, ra, an, nk, fra, ran, ank, fran, rank
fraps, f, r, a, p, s, fr, ra, ap, ps, fra, rap, aps, frap, raps
frass, f, r, a, s, s, fr, ra, as, ss, fra, ras, ass, fras, rass
frats, f, r, a, t, s, fr, ra, at, ts, fra, rat, ats, frat, rats
fraud, f, r, a, u, d, fr, ra, au, ud, fra, rau, aud, frau, raud
frays, f, r, a, y, s, fr, ra, ay, ys, fra, ray, ays, fray, rays
freak, f, r, e, a, k, fr, re, ea, ak, fre, rea, eak, frea, reak
freed, f, r, e, e, d, fr, re, ee, ed, fre, ree, eed, free, reed
freer, f, r, e, e, r, fr, re, ee, er, fre, ree, eer, free, reer
frees, f, r, e, e, s, fr, re, ee, es, fre, ree, ees, free, rees
